{
  "documentList": [
    {
      "productId": "kd-65z9d-in5_en_IN",
      "locale": "en_IN",
      "skuName": "KD-65Z9D IN5",
      "modelName": "KD-65Z9D",
      "superModelName": "Z9D Series",
      "tier": "1",
      "marketingProductName": "Z9D 4K HDR with Android TV",
      "longMarketingProductName": "Z9D | LED | 4K Ultra HD | High Dynamic Range (HDR) | Smart TV (Android TV™)",
      "longDescription": "Experience the most stunning picture with the ZD9 4K HDR Android TV, featuring the 4K HDR Processor X1 Extreme and the LED Backlight Master Drive. Explore here.",
      "mainCategory": [
        "tv-home-cinema",
        "tvs",
        "televisions"
      ],
      "featureIcons": [
        "Available in 164 cm (65)",
        "4K High Dynamic Range",
        "4K HDR Processor X1™ Extreme",
        "Backlight Master Drive™",
        "Android TV"
      ],
      "topFeatures": [
        "4K HDR Processor X1 Extreme for ultimate realism",
        "Unprecedented contrast with Backlight Master Drive",
        "Amazing contrast with X-tended Dynamic Range™ PRO",
        "Wide colour gamut with TRILUMINOS Display"
      ],
      "sunriseDateTime": 1476255600000,
      "createdAt": 1476255305205,
      "identifiers_bazaarVoiceExternalId": "kd-65z9d-in5",
      "identifiers_id": "urn:sony:product:sku:[sku]kd_65_z9_d_in5_en_in",
      "ecoFeatures": [
        "Dynamic Backlight Control helps improve energy efficiency by adjusting backlight brightness as picture content changes.",
        "Power Saving Mode helps save energy by adjusting backlight brightness.",
        "Back Light Off Mode helps save energy by turning picture off which is realized by both display off on LCD panel and back-light off."
      ],
      "imagesPrimaryShot": [
        "//sonyglobal.scene7.com/is/image/gwtprod/a9a1a4facfa90abf80b09ac5d1509de7?fmt=png-alpha"
      ],
      "imagesProductShot": [
        "//sonyglobal.scene7.com/is/image/gwtprod/4ccdd026feda542f3ded3cf9f5c3792a?fmt=png-alpha",
        "//sonyglobal.scene7.com/is/image/gwtprod/86f01c97825b2f04ff6051448683fed2?fmt=png-alpha",
        "//sonyglobal.scene7.com/is/image/gwtprod/1c7a3cf51a32acc2fafe029b57d740d9?fmt=png-alpha",
        "//sonyglobal.scene7.com/is/image/gwtprod/918517c03810f35d5c68113738c7cdf1?fmt=png-alpha",
        "//sonyglobal.scene7.com/is/image/gwtprod/c09a7c2fb87e2e64c1a9382ae6797ee0?fmt=png-alpha",
        "//sonyglobal.scene7.com/is/image/gwtprod/c45aa6c1f7ba8c7c9668908bcb244db1?fmt=png-alpha",
        "//sonyglobal.scene7.com/is/image/gwtprod/1503baae2294dc77bb600929d648b80f?fmt=png-alpha",
        "//sonyglobal.scene7.com/is/image/gwtprod/6e780a96f2b75e7b7f9d22c7e1843420?fmt=png-alpha",
        "//sonyglobal.scene7.com/is/image/gwtprod/d0bb516a95a64b59f50060df18de51c9?fmt=png-alpha",
        "//sonyglobal.scene7.com/is/image/gwtprod/96658fb0741c40ad62691693406e5d83?fmt=png-alpha",
        "//sonyglobal.scene7.com/is/image/gwtprod/e2061b68ccec062e5edb459d550140e6?fmt=png-alpha"
      ],
      "featureBenefits": [
        "Backlight Master Drive™",
        " || The Backlight Master Drive™ is a full-array LED backlight technology that combines an ultra-dense LED structure, a spectacular algorithm and a completely new optical design. Powered by the 4K HDR Processor™ X1 Extreme, this technology delivers incredibly deep black, dazzling lights and more vibrant colour. ",
        " || ",
        " || //sonyglobal.scene7.com/is/image/gwtprod/93abebedf98605e91d91881c4e04ed8f?fmt=jpeg",
        "4K HDR Processor X1™ Extreme: So real you can feel it",
        " || Made to enhance the latest generation of 4K HDR pictures, the 4K HDR Processor X1™ Extreme brings reality to every scene. With 40% more real-time image processing than our renowned 4K Processor X1™, it delivers unprecedented picture quality for everything you watch, upscaling content from any source nearer to 4K HDR quality.",
        " || ",
        " || //sonyglobal.scene7.com/is/image/gwtprod/a68eed5e04bbdbea2da587cc974cc161?fmt=jpeg",
        "Uncover the detail with 4K HDR",
        " || A High Dynamic Range (HDR) compatible TV will change the way you look at TV. Combined with 4K Ultra HD resolution, HDR video content delivers exceptional detail, colour and contrast, with a far wider range of brightness than other video formats. The result is the most lifelike picture that TV has ever been able to create, with brilliant highlights and fine detail.",
        " || ",
        " || //sonyglobal.scene7.com/is/image/gwtprod/4fd45e3ec09cede1cf537c428165c504?fmt=jpeg",
        "Backlight Master Drive™",
        " || The Backlight Master Drive™ is a backlight technology that combines an ultra-dense LED structure, a spectacular algorithm and a completely new optical design. Powered by the 4K HDR Processor™ X1 Extreme, this technology delivers incredibly deep black, dazzling lights and more vibrant colour than you've ever seen on the big screen.",
        " || ",
        " || //sonyglobal.scene7.com/is/image/gwtprod/f6cf5e03ee280b7450a5530f9c24fed2?fmt=jpeg",
        "TRILUMINOS™ Display: Extra colours, extra brilliance",
        " || More colours means more realism. A TRILUMINOS™ Display with its specially-developed backlight selectively maps colours across a wider gamut, ensuring subtle colours do not become oversaturated and unnatural. You'll enjoy vivid, authentic images that evoke the emotion in every scene. ",
        " || ",
        " || //sonyglobal.scene7.com/is/image/gwtprod/79c6cebfffa2ff6ab89719259763642e?fmt=jpeg",
        "Dual database processing",
        " || The 4K HDR Processor X1™ Extreme has two imaging databases that work together in real time to improve your picture. By searching through thousands of picture patterns in Sony-exclusive databases for noise reduction and super-resolution, they remove unwanted noise and upscale every image to the clarity of 4K, so you can enjoy incredible picture quality no matter the source.",
        " || ",
        " || //sonyglobal.scene7.com/is/image/gwtprod/d6fec408511bde3ef920d985a9acf032?fmt=jpeg",
        "Explore new worlds with Android TV™",
        " || Your smart TV just got smarter. Enjoy many of your favourite smartphone and tablet experiences on a big, beautiful BRAVIA™ screen. Android TV™ with advanced voice control lets you connect and access content, from movies and TV shows to thousands of apps, simply by talking.",
        " || ",
        " || //sonyglobal.scene7.com/is/image/gwtprod/d1f784becc5611ca2f7913bcbe73ea3e?fmt=jpeg",
        "This TV is recommended by Netflix",
        " || Get a better streaming experience with a Netflix Recommended TV. A Netflix Recommended TV is chosen for its high performance, cutting-edge smart features and easy app access. You can also watch Marco Polo in 4K HDR today, with a premium Netflix subscription. Members will be able to enjoy more HDR content in the coming months. ",
        " || ",
        " || //sonyglobal.scene7.com/is/image/gwtprod/440700d76da976168b2dd9a6ae52d86b?fmt=jpeg",
        "Premium gold finish",
        " || The sophisticated aluminium bezel is finished with a strip of gold finish for a refined look that gives a premium feel to any space. The pale gold colour sits perfectly alongside your furniture for an elegant viewing experience.",
        " || ",
        " || //sonyglobal.scene7.com/is/image/gwtprod/804fdf8f15f06745b7da5d85f7bf09d5?fmt=jpeg",
        "Clean rear look",
        " || Keep wires out of sight, thanks to a hidden cable panel structure. All of your cables are fully concealed behind the panel, and run down through the centre of the stand, so everything looks tidy.",
        " || ",
        " || //sonyglobal.scene7.com/is/image/gwtprod/2d304a2cb33ade1f7f5171f1e5af0211?fmt=jpeg",
        "Easy to plug and play",
        " || Easily connect a USB or HDMI into the side of your TV to start playing. Just close the side cover to keep things tidy when you're not using it.",
        " || ",
        " || //sonyglobal.scene7.com/is/image/gwtprod/b9f45a0d005206bcf9fd44ca0767faf3?fmt=jpeg",
        "Cable-free front",
        " || All of your cables can be neatly arranged across the back of the TV and channelled into the stand, so there are no wires visible from the front.",
        " || ",
        " || //sonyglobal.scene7.com/is/image/gwtprod/818fc0ef8e063ec5a89ef4d366bf394d?fmt=jpeg",
        "Super slim flush surface display",
        " || The screen on this ultra-thin 4K HDR TV has a full flush surface and super-thin bezel so you stay focused on the picture.",
        " || ",
        " || //sonyglobal.scene7.com/is/image/gwtprod/c52024ebe71c293e6352219289b2036c?fmt=jpeg",
        "Motionflow™ XR keeps the action smooth",
        " || Enjoy smooth and sharp details even in fast-moving sequences with Motionflow™ XR. This innovative technology creates and inserts extra frames between the original ones. It compares key visual factors on successive frames, then calculates the split second of missing action in the sequences. Some models also include black-frame insertion for a blur-free and truly cinematic look.",
        " || ",
        " || //sonyglobal.scene7.com/is/image/gwtprod/69b98bb59b8f696e08e788851ca68c17?fmt=jpeg",
        "Backlight Master Drive™: Calibrated beam LED design",
        " || The Backlight Master Drive™ has a new optical LED design which keeps light only where it's needed in each scene. By gathering light more effectively, the design reduces diffusion and the flare effect that might be seen on other full-array TVs, for greater brightness and more accurate contrast than ever before.",
        " || ",
        " || //sonyglobal.scene7.com/is/image/gwtprod/e3029ebca9d72560281d85575a51d4b5?fmt=jpeg",
        "Object-based HDR remaster",
        " || By analyzing the objects in each scene individually, Object-based HDR remaster optimizes and enhances colour and contrast. It brings everything you watch closer to the quality of HDR. Dark elements get darker, bright elements brighter and everything in between is more accurately lit, for never-before-possible realism in every scene.",
        " || ",
        " || //sonyglobal.scene7.com/is/image/gwtprod/3b73d11ea246bb0c06a84efa1dd7f40d?fmt=jpeg",
        "Super Bit Mapping™ 4K HDR",
        " || Super Bit Mapping™ 4K HDR creates a smoother, more natural picture by minimizing its colour banding. With 14-bit powerful signal processing, it breaks up the solid bands of colour of an 8-bit or 10-bit source, up-converting to 14-bit equivalent gradation, with 64 times more colour levels. It delivers graceful reproduction of faces, sunsets and other areas of subtle colour gradation.",
        " || ",
        " || //sonyglobal.scene7.com/is/image/gwtprod/a3114947986d5bf6d790ccf3886a105d?fmt=jpeg",
        "Dual database processing",
        " || The 4K HDR Processor X1™ Extreme has two imaging databases that work together in real time to improve your picture. By searching through thousands of picture patterns in Sony-exclusive databases for noise reduction and super-resolution, they remove unwanted noise and upscale every image to the clarity of 4K, so you can enjoy incredible picture quality no matter the source.",
        " || ",
        " || //sonyglobal.scene7.com/is/image/gwtprod/dcb41d373835e9a9c7b5b8c42edffa2a?fmt=jpeg",
        "Say what you want to see with voice search",
        " || Spend less time browsing, and more time watching. Voice search on Android TV™ provides you with the power of Google search, allowing you to find content across different services without the hassle of time-consuming text entry. You can also get recommendations; asking for \"romantic comedies\", for example, brings up a list of suitable options.",
        " || ",
        " || //sonyglobal.scene7.com/is/image/gwtprod/ba034edb59b5194afa7385f161208a8f?fmt=jpeg",
        "Content Bar: Find everything fast",
        " || The unobtrusive Content Bar quickly lets you find the movie, TV show or video you’re looking for. Call up the Content Bar and you can keep watching while you scan through live TV, videos on demand, downloaded TV shows and much more. You can even customise the content bar to show you the content you go to most often first. ",
        " || ",
        " || //sonyglobal.scene7.com/is/image/gwtprod/3bd20dd80bd10ef29c60448bc464762a?fmt=png-alpha",
        "Chromecast built-in: Plays nice with your other devices",
        " || BRAVIA™ is Chromecast built-in ready so you can easily cast your favourite entertainment like YouTube™ or Netflix from your personal device on to the stunning BRAVIA™ screen. You can cast from Android™, iOS™ or your laptop.",
        " || ",
        " || //sonyglobal.scene7.com/is/image/gwtprod/e9788aff1f6fdd44b84a87db81b7df9a?fmt=jpeg",
        "Google Play™: A world of content and apps",
        " || Discover movies and TV shows, games and much more from Google Play™. Enjoy a huge and ever-growing choice of apps on your TV in a brand new way.",
        " || ",
        " || //sonyglobal.scene7.com/is/image/gwtprod/f4d3f43a04480099dd9b55b6ce6e299a?fmt=jpeg",
        "Made to listen: ClearAudio+",
        " || Make your listening as lifelike as your viewing. ClearAudio+ fine-tunes TV sound for an immersive experience that seems to surround you. Hear music, dialogue and surround effects with greater clarity and separation, whatever you're watching.",
        " || ",
        " || //sonyglobal.scene7.com/is/image/gwtprod/f7d3418891d4f8f337c992ba27916811?fmt=jpeg",
        "DSEE restores detail to your digital music",
        " || Low-resolution Internet video, catch-up TV and other heavily compressed audio files don't always sound so great. A large amount of information gets thrown away when digital audio is compressed. With Digital Sound Enhancement Engine (DSEE) technology, lost frequency components (especially high frequencies) are restored for natural sound with a more spacious feel.",
        " || ",
        " || //sonyglobal.scene7.com/is/image/gwtprod/640aae2ff025ae44a1aa4f3e839ae312?fmt=jpeg",
        "Clear Phase for smooth, balanced frequencies",
        " || BRAVIA™ uses a powerful computer model to analyse and compensate for inaccuracies in speaker response. It does this by 'sampling' the speaker frequency with higher precision. This information is fed back to cancel out any peaks or dips in the speaker's natural response – resulting in pure, natural audio with smooth, even reproduction of all frequencies.",
        " || ",
        " || //sonyglobal.scene7.com/is/image/gwtprod/d136a6a3644b8bf260ac587e38521d9d?fmt=jpeg",
        "Cinematic S-Force Front Surround",
        " || Enjoy an immersive soundstage that pulls you into the heart of the action. S-Force Front Surround mimics the way the brain correlates sound sources to create proper volume, time lag and sound wave spectrum — using only left and right speaker channels. By naturally emulating three-dimensional sound fields, you'll enjoy rich, high-fidelity audio across a wider listening area.",
        " || ",
        " || //sonyglobal.scene7.com/is/image/gwtprod/9b2924f3fbefbfe19257c6ed16ff1647?fmt=jpeg",
        "Turn your TV into a digital recorder: USB HDD REC",
        " || Store your favourite TV shows on an external USB hard disk drive to enjoy whenever you want. USB HDD REC allows one-touch and timer recording of a digital broadcast onto any USB HDD device up to 2 TB in capacity. While viewing the show, simply press REC to start recording, which will automatically stop at the end of the programme.",
        " || ",
        " || //sonyglobal.scene7.com/is/image/gwtprod/a5aec82b14bd1e35fc3fe3ae458b56d7?fmt=jpeg",
        "IR Blaster: Control everything with one remote",
        " || The Infra-red (IR) Blaster lets you control other devices in your home from your Sony TV remote. You can use it to control your set-top box (cable box) with the TV remote controller.",
        " || ",
        " || //sonyglobal.scene7.com/is/image/gwtprod/e3ec9771c78f941341a4b8520507a19d?fmt=jpeg",
        "YouView: The best of catch-up and on-demand TV",
        " || With YouView built-in, you can scroll back up to seven days to watch shows from catch-up TV services. You can also access an extensive library of on-demand content. Simply connect your BRAVIA™ to an aerial and broadband connection to get started with YouView.",
        " || ",
        " || //sonyglobal.scene7.com/is/image/gwtprod/d2635895135a0b6d60c0d19c91e70112?fmt=jpeg",
        "Enjoy HDR gaming with PlayStation®",
        " || Sony 4K HDR televisions are perfect partners for PlayStation®4 and PlayStation®4 Pro consoles. Immerse yourself in a responsive, fun-filled gaming experience with vivid textures and intensely vibrant colours. See your favourite games come to life with the incredible picture quality.",
        " || ",
        " || //sonyglobal.scene7.com/is/image/gwtprod/a034ae3494e799f96d98c4f450f47808?fmt=jpeg"
      ],
      "factualShortDescription": "4K Ultra HD TV with 4K HDR Processor X1™ Extreme and Backlight Master Drive™",
      "elevatorPitch": "Discover a picture unlike any other in 4K HDR with ultra-contrast.",
      "mainProductType": "television",
      "tvFeatures": [
        "4K HDR Processor X1 Extreme",
        "X-tended dynamic range",
        "TRILUMINOS display",
        "X-Reality PRO"
      ],
      "televisionScreenSize": "154+ cm (61+)",
      "tvType": [
        "LED",
        "4K HDR TVs",
        "4K Ultra HD",
        "Android TV",
        "Smart TV",
        "High Dynamic Range (HDR)",
        "Netflix Recommended TV",
        "stand4k"
      ],
      "inTheBox": [
        "Analogue Extension Cable",
        "Voice Remote Control type (RMFTX201P)",
        "3D Glasses x 2pcs (TDG-BT400A)",
        "Batteries",
        "AC Power Cord",
        "IR Blaster",
        "Operating Instructions",
        "Quick Setup Guide",
        "Table Top Stand (separate assembly required))"
      ],
      "tvScreenSize": "164 cm (65)",
      "productFileName": "kd-65z9d-in5.json",
      "fullProductInfo": "productId= kd-65z9d-in5_en_IN, locale= en_IN, skuName= KD-65Z9D IN5, modelName= KD-65Z9D, superModelName= Z9D Series, tier= 1, marketingProductName= Z9D 4K HDR with Android TV, longMarketingProductName= Z9D | LED | 4K Ultra HD | High Dynamic Range (HDR) | Smart TV (Android TV™), longDescription= Experience the most stunning picture with the ZD9 4K HDR Android TV, featuring the 4K HDR Processor X1 Extreme and the LED Backlight Master Drive. Explore here., mainCategory= [tv-home-cinema, tvs, televisions], featureIcons= [Available in 164 cm (65), 4K High Dynamic Range, 4K HDR Processor X1™ Extreme, Backlight Master Drive™, Android TV], techSpecs= null, keyTechSpecs= null, topFeatures= [4K HDR Processor X1 Extreme for ultimate realism, Unprecedented contrast with Backlight Master Drive, Amazing contrast with X-tended Dynamic Range™ PRO, Wide colour gamut with TRILUMINOS Display], sunriseDateTime= 1.4762556E12, createdAt= 1.476255305205E12, identifiers_bazaarVoiceExternalId= kd-65z9d-in5, identifiers_id= urn:sony:product:sku:[sku]kd_65_z9_d_in5_en_in, ecoFeatures= [Dynamic Backlight Control helps improve energy efficiency by adjusting backlight brightness as picture content changes., Power Saving Mode helps save energy by adjusting backlight brightness., Back Light Off Mode helps save energy by turning picture off which is realized by both display off on LCD panel and back-light off.], imagesPrimaryShot= [//sonyglobal.scene7.com/is/image/gwtprod/a9a1a4facfa90abf80b09ac5d1509de7?fmt=png-alpha], imagesProductShot= [//sonyglobal.scene7.com/is/image/gwtprod/4ccdd026feda542f3ded3cf9f5c3792a?fmt=png-alpha, //sonyglobal.scene7.com/is/image/gwtprod/86f01c97825b2f04ff6051448683fed2?fmt=png-alpha, //sonyglobal.scene7.com/is/image/gwtprod/1c7a3cf51a32acc2fafe029b57d740d9?fmt=png-alpha, //sonyglobal.scene7.com/is/image/gwtprod/918517c03810f35d5c68113738c7cdf1?fmt=png-alpha, //sonyglobal.scene7.com/is/image/gwtprod/c09a7c2fb87e2e64c1a9382ae6797ee0?fmt=png-alpha, //sonyglobal.scene7.com/is/image/gwtprod/c45aa6c1f7ba8c7c9668908bcb244db1?fmt=png-alpha, //sonyglobal.scene7.com/is/image/gwtprod/1503baae2294dc77bb600929d648b80f?fmt=png-alpha, //sonyglobal.scene7.com/is/image/gwtprod/6e780a96f2b75e7b7f9d22c7e1843420?fmt=png-alpha, //sonyglobal.scene7.com/is/image/gwtprod/d0bb516a95a64b59f50060df18de51c9?fmt=png-alpha, //sonyglobal.scene7.com/is/image/gwtprod/96658fb0741c40ad62691693406e5d83?fmt=png-alpha, //sonyglobal.scene7.com/is/image/gwtprod/e2061b68ccec062e5edb459d550140e6?fmt=png-alpha], featureBenefits= [Backlight Master Drive™,  || The Backlight Master Drive™ is a full-array LED backlight technology that combines an ultra-dense LED structure, a spectacular algorithm and a completely new optical design. Powered by the 4K HDR Processor™ X1 Extreme, this technology delivers incredibly deep black, dazzling lights and more vibrant colour. ,  || ,  || //sonyglobal.scene7.com/is/image/gwtprod/93abebedf98605e91d91881c4e04ed8f?fmt=jpeg, 4K HDR Processor X1™ Extreme: So real you can feel it,  || Made to enhance the latest generation of 4K HDR pictures, the 4K HDR Processor X1™ Extreme brings reality to every scene. With 40% more real-time image processing than our renowned 4K Processor X1™, it delivers unprecedented picture quality for everything you watch, upscaling content from any source nearer to 4K HDR quality.,  || ,  || //sonyglobal.scene7.com/is/image/gwtprod/a68eed5e04bbdbea2da587cc974cc161?fmt=jpeg, Uncover the detail with 4K HDR,  || A High Dynamic Range (HDR) compatible TV will change the way you look at TV. Combined with 4K Ultra HD resolution, HDR video content delivers exceptional detail, colour and contrast, with a far wider range of brightness than other video formats. The result is the most lifelike picture that TV has ever been able to create, with brilliant highlights and fine detail.,  || ,  || //sonyglobal.scene7.com/is/image/gwtprod/4fd45e3ec09cede1cf537c428165c504?fmt=jpeg, Backlight Master Drive™,  || The Backlight Master Drive™ is a backlight technology that combines an ultra-dense LED structure, a spectacular algorithm and a completely new optical design. Powered by the 4K HDR Processor™ X1 Extreme, this technology delivers incredibly deep black, dazzling lights and more vibrant colour than you've ever seen on the big screen.,  || ,  || //sonyglobal.scene7.com/is/image/gwtprod/f6cf5e03ee280b7450a5530f9c24fed2?fmt=jpeg, TRILUMINOS™ Display: Extra colours, extra brilliance,  || More colours means more realism. A TRILUMINOS™ Display with its specially-developed backlight selectively maps colours across a wider gamut, ensuring subtle colours do not become oversaturated and unnatural. You'll enjoy vivid, authentic images that evoke the emotion in every scene. ,  || ,  || //sonyglobal.scene7.com/is/image/gwtprod/79c6cebfffa2ff6ab89719259763642e?fmt=jpeg, Dual database processing,  || The 4K HDR Processor X1™ Extreme has two imaging databases that work together in real time to improve your picture. By searching through thousands of picture patterns in Sony-exclusive databases for noise reduction and super-resolution, they remove unwanted noise and upscale every image to the clarity of 4K, so you can enjoy incredible picture quality no matter the source.,  || ,  || //sonyglobal.scene7.com/is/image/gwtprod/d6fec408511bde3ef920d985a9acf032?fmt=jpeg, Explore new worlds with Android TV™,  || Your smart TV just got smarter. Enjoy many of your favourite smartphone and tablet experiences on a big, beautiful BRAVIA™ screen. Android TV™ with advanced voice control lets you connect and access content, from movies and TV shows to thousands of apps, simply by talking.,  || ,  || //sonyglobal.scene7.com/is/image/gwtprod/d1f784becc5611ca2f7913bcbe73ea3e?fmt=jpeg, This TV is recommended by Netflix,  || Get a better streaming experience with a Netflix Recommended TV. A Netflix Recommended TV is chosen for its high performance, cutting-edge smart features and easy app access. You can also watch Marco Polo in 4K HDR today, with a premium Netflix subscription. Members will be able to enjoy more HDR content in the coming months. ,  || ,  || //sonyglobal.scene7.com/is/image/gwtprod/440700d76da976168b2dd9a6ae52d86b?fmt=jpeg, Premium gold finish,  || The sophisticated aluminium bezel is finished with a strip of gold finish for a refined look that gives a premium feel to any space. The pale gold colour sits perfectly alongside your furniture for an elegant viewing experience.,  || ,  || //sonyglobal.scene7.com/is/image/gwtprod/804fdf8f15f06745b7da5d85f7bf09d5?fmt=jpeg, Clean rear look,  || Keep wires out of sight, thanks to a hidden cable panel structure. All of your cables are fully concealed behind the panel, and run down through the centre of the stand, so everything looks tidy.,  || ,  || //sonyglobal.scene7.com/is/image/gwtprod/2d304a2cb33ade1f7f5171f1e5af0211?fmt=jpeg, Easy to plug and play,  || Easily connect a USB or HDMI into the side of your TV to start playing. Just close the side cover to keep things tidy when you're not using it.,  || ,  || //sonyglobal.scene7.com/is/image/gwtprod/b9f45a0d005206bcf9fd44ca0767faf3?fmt=jpeg, Cable-free front,  || All of your cables can be neatly arranged across the back of the TV and channelled into the stand, so there are no wires visible from the front.,  || ,  || //sonyglobal.scene7.com/is/image/gwtprod/818fc0ef8e063ec5a89ef4d366bf394d?fmt=jpeg, Super slim flush surface display,  || The screen on this ultra-thin 4K HDR TV has a full flush surface and super-thin bezel so you stay focused on the picture.,  || ,  || //sonyglobal.scene7.com/is/image/gwtprod/c52024ebe71c293e6352219289b2036c?fmt=jpeg, Motionflow™ XR keeps the action smooth,  || Enjoy smooth and sharp details even in fast-moving sequences with Motionflow™ XR. This innovative technology creates and inserts extra frames between the original ones. It compares key visual factors on successive frames, then calculates the split second of missing action in the sequences. Some models also include black-frame insertion for a blur-free and truly cinematic look.,  || ,  || //sonyglobal.scene7.com/is/image/gwtprod/69b98bb59b8f696e08e788851ca68c17?fmt=jpeg, Backlight Master Drive™: Calibrated beam LED design,  || The Backlight Master Drive™ has a new optical LED design which keeps light only where it's needed in each scene. By gathering light more effectively, the design reduces diffusion and the flare effect that might be seen on other full-array TVs, for greater brightness and more accurate contrast than ever before.,  || ,  || //sonyglobal.scene7.com/is/image/gwtprod/e3029ebca9d72560281d85575a51d4b5?fmt=jpeg, Object-based HDR remaster,  || By analyzing the objects in each scene individually, Object-based HDR remaster optimizes and enhances colour and contrast. It brings everything you watch closer to the quality of HDR. Dark elements get darker, bright elements brighter and everything in between is more accurately lit, for never-before-possible realism in every scene.,  || ,  || //sonyglobal.scene7.com/is/image/gwtprod/3b73d11ea246bb0c06a84efa1dd7f40d?fmt=jpeg, Super Bit Mapping™ 4K HDR,  || Super Bit Mapping™ 4K HDR creates a smoother, more natural picture by minimizing its colour banding. With 14-bit powerful signal processing, it breaks up the solid bands of colour of an 8-bit or 10-bit source, up-converting to 14-bit equivalent gradation, with 64 times more colour levels. It delivers graceful reproduction of faces, sunsets and other areas of subtle colour gradation.,  || ,  || //sonyglobal.scene7.com/is/image/gwtprod/a3114947986d5bf6d790ccf3886a105d?fmt=jpeg, Dual database processing,  || The 4K HDR Processor X1™ Extreme has two imaging databases that work together in real time to improve your picture. By searching through thousands of picture patterns in Sony-exclusive databases for noise reduction and super-resolution, they remove unwanted noise and upscale every image to the clarity of 4K, so you can enjoy incredible picture quality no matter the source.,  || ,  || //sonyglobal.scene7.com/is/image/gwtprod/dcb41d373835e9a9c7b5b8c42edffa2a?fmt=jpeg, Say what you want to see with voice search,  || Spend less time browsing, and more time watching. Voice search on Android TV™ provides you with the power of Google search, allowing you to find content across different services without the hassle of time-consuming text entry. You can also get recommendations; asking for \"romantic comedies\", for example, brings up a list of suitable options.,  || ,  || //sonyglobal.scene7.com/is/image/gwtprod/ba034edb59b5194afa7385f161208a8f?fmt=jpeg, Content Bar: Find everything fast,  || The unobtrusive Content Bar quickly lets you find the movie, TV show or video you’re looking for. Call up the Content Bar and you can keep watching while you scan through live TV, videos on demand, downloaded TV shows and much more. You can even customise the content bar to show you the content you go to most often first. ,  || ,  || //sonyglobal.scene7.com/is/image/gwtprod/3bd20dd80bd10ef29c60448bc464762a?fmt=png-alpha, Chromecast built-in: Plays nice with your other devices,  || BRAVIA™ is Chromecast built-in ready so you can easily cast your favourite entertainment like YouTube™ or Netflix from your personal device on to the stunning BRAVIA™ screen. You can cast from Android™, iOS™ or your laptop.,  || ,  || //sonyglobal.scene7.com/is/image/gwtprod/e9788aff1f6fdd44b84a87db81b7df9a?fmt=jpeg, Google Play™: A world of content and apps,  || Discover movies and TV shows, games and much more from Google Play™. Enjoy a huge and ever-growing choice of apps on your TV in a brand new way.,  || ,  || //sonyglobal.scene7.com/is/image/gwtprod/f4d3f43a04480099dd9b55b6ce6e299a?fmt=jpeg, Made to listen: ClearAudio+,  || Make your listening as lifelike as your viewing. ClearAudio+ fine-tunes TV sound for an immersive experience that seems to surround you. Hear music, dialogue and surround effects with greater clarity and separation, whatever you're watching.,  || ,  || //sonyglobal.scene7.com/is/image/gwtprod/f7d3418891d4f8f337c992ba27916811?fmt=jpeg, DSEE restores detail to your digital music,  || Low-resolution Internet video, catch-up TV and other heavily compressed audio files don't always sound so great. A large amount of information gets thrown away when digital audio is compressed. With Digital Sound Enhancement Engine (DSEE) technology, lost frequency components (especially high frequencies) are restored for natural sound with a more spacious feel.,  || ,  || //sonyglobal.scene7.com/is/image/gwtprod/640aae2ff025ae44a1aa4f3e839ae312?fmt=jpeg, Clear Phase for smooth, balanced frequencies,  || BRAVIA™ uses a powerful computer model to analyse and compensate for inaccuracies in speaker response. It does this by 'sampling' the speaker frequency with higher precision. This information is fed back to cancel out any peaks or dips in the speaker's natural response – resulting in pure, natural audio with smooth, even reproduction of all frequencies.,  || ,  || //sonyglobal.scene7.com/is/image/gwtprod/d136a6a3644b8bf260ac587e38521d9d?fmt=jpeg, Cinematic S-Force Front Surround,  || Enjoy an immersive soundstage that pulls you into the heart of the action. S-Force Front Surround mimics the way the brain correlates sound sources to create proper volume, time lag and sound wave spectrum — using only left and right speaker channels. By naturally emulating three-dimensional sound fields, you'll enjoy rich, high-fidelity audio across a wider listening area.,  || ,  || //sonyglobal.scene7.com/is/image/gwtprod/9b2924f3fbefbfe19257c6ed16ff1647?fmt=jpeg, Turn your TV into a digital recorder: USB HDD REC,  || Store your favourite TV shows on an external USB hard disk drive to enjoy whenever you want. USB HDD REC allows one-touch and timer recording of a digital broadcast onto any USB HDD device up to 2 TB in capacity. While viewing the show, simply press REC to start recording, which will automatically stop at the end of the programme.,  || ,  || //sonyglobal.scene7.com/is/image/gwtprod/a5aec82b14bd1e35fc3fe3ae458b56d7?fmt=jpeg, IR Blaster: Control everything with one remote,  || The Infra-red (IR) Blaster lets you control other devices in your home from your Sony TV remote. You can use it to control your set-top box (cable box) with the TV remote controller.,  || ,  || //sonyglobal.scene7.com/is/image/gwtprod/e3ec9771c78f941341a4b8520507a19d?fmt=jpeg, YouView: The best of catch-up and on-demand TV,  || With YouView built-in, you can scroll back up to seven days to watch shows from catch-up TV services. You can also access an extensive library of on-demand content. Simply connect your BRAVIA™ to an aerial and broadband connection to get started with YouView.,  || ,  || //sonyglobal.scene7.com/is/image/gwtprod/d2635895135a0b6d60c0d19c91e70112?fmt=jpeg, Enjoy HDR gaming with PlayStation®,  || Sony 4K HDR televisions are perfect partners for PlayStation®4 and PlayStation®4 Pro consoles. Immerse yourself in a responsive, fun-filled gaming experience with vivid textures and intensely vibrant colours. See your favourite games come to life with the incredible picture quality.,  || ,  || //sonyglobal.scene7.com/is/image/gwtprod/a034ae3494e799f96d98c4f450f47808?fmt=jpeg], factualShortDescription= 4K Ultra HD TV with 4K HDR Processor X1™ Extreme and Backlight Master Drive™, elevatorPitch= Discover a picture unlike any other in 4K HDR with ultra-contrast., mainProductType= television, tvFeatures= [4K HDR Processor X1 Extreme, X-tended dynamic range, TRILUMINOS display, X-Reality PRO], televisionScreenSize= 154+ cm (61+), tvType= [LED, 4K HDR TVs, 4K Ultra HD, Android TV, Smart TV, High Dynamic Range (HDR), Netflix Recommended TV, stand4k], inTheBox= [Analogue Extension Cable, Voice Remote Control type (RMFTX201P), 3D Glasses x 2pcs (TDG-BT400A), Batteries, AC Power Cord, IR Blaster, Operating Instructions, Quick Setup Guide, Table Top Stand (separate assembly required))], envStatement= null, envLink= null, model= null, superModel= null, tvScreenSize= 164 cm (65), productFileName= kd-65z9d-in5.json",
      "_version_": 1572442397509419008
    },
    {
      "productId": "kd-65z9d-in5_en_IN",
      "locale": "en_IN",
      "skuName": "KD-65Z9D IN5",
      "modelName": "KD-65Z9D",
      "superModelName": "Z9D Series",
      "tier": "1",
      "marketingProductName": "Z9D 4K HDR with Android TV",
      "longMarketingProductName": "Z9D | LED | 4K Ultra HD | High Dynamic Range (HDR) | Smart TV (Android TV™)",
      "longDescription": "Experience the most stunning picture with the ZD9 4K HDR Android TV, featuring the 4K HDR Processor X1 Extreme and the LED Backlight Master Drive. Explore here.",
      "mainCategory": [
        "tv-home-cinema",
        "tvs",
        "televisions"
      ],
      "featureIcons": [
        "Available in 164 cm (65)",
        "4K High Dynamic Range",
        "4K HDR Processor X1™ Extreme",
        "Backlight Master Drive™",
        "Android TV"
      ],
      "topFeatures": [
        "4K HDR Processor X1 Extreme for ultimate realism",
        "Unprecedented contrast with Backlight Master Drive",
        "Amazing contrast with X-tended Dynamic Range™ PRO",
        "Wide colour gamut with TRILUMINOS Display"
      ],
      "sunriseDateTime": 1476255600000,
      "createdAt": 1476255305205,
      "identifiers_bazaarVoiceExternalId": "kd-65z9d-in5",
      "identifiers_id": "urn:sony:product:sku:[sku]kd_65_z9_d_in5_en_in",
      "ecoFeatures": [
        "Dynamic Backlight Control helps improve energy efficiency by adjusting backlight brightness as picture content changes.",
        "Power Saving Mode helps save energy by adjusting backlight brightness.",
        "Back Light Off Mode helps save energy by turning picture off which is realized by both display off on LCD panel and back-light off."
      ],
      "imagesPrimaryShot": [
        "//sonyglobal.scene7.com/is/image/gwtprod/a9a1a4facfa90abf80b09ac5d1509de7?fmt=png-alpha"
      ],
      "imagesProductShot": [
        "//sonyglobal.scene7.com/is/image/gwtprod/4ccdd026feda542f3ded3cf9f5c3792a?fmt=png-alpha",
        "//sonyglobal.scene7.com/is/image/gwtprod/86f01c97825b2f04ff6051448683fed2?fmt=png-alpha",
        "//sonyglobal.scene7.com/is/image/gwtprod/1c7a3cf51a32acc2fafe029b57d740d9?fmt=png-alpha",
        "//sonyglobal.scene7.com/is/image/gwtprod/918517c03810f35d5c68113738c7cdf1?fmt=png-alpha",
        "//sonyglobal.scene7.com/is/image/gwtprod/c09a7c2fb87e2e64c1a9382ae6797ee0?fmt=png-alpha",
        "//sonyglobal.scene7.com/is/image/gwtprod/c45aa6c1f7ba8c7c9668908bcb244db1?fmt=png-alpha",
        "//sonyglobal.scene7.com/is/image/gwtprod/1503baae2294dc77bb600929d648b80f?fmt=png-alpha",
        "//sonyglobal.scene7.com/is/image/gwtprod/6e780a96f2b75e7b7f9d22c7e1843420?fmt=png-alpha",
        "//sonyglobal.scene7.com/is/image/gwtprod/d0bb516a95a64b59f50060df18de51c9?fmt=png-alpha",
        "//sonyglobal.scene7.com/is/image/gwtprod/96658fb0741c40ad62691693406e5d83?fmt=png-alpha",
        "//sonyglobal.scene7.com/is/image/gwtprod/e2061b68ccec062e5edb459d550140e6?fmt=png-alpha"
      ],
      "featureBenefits": [
        "Backlight Master Drive™",
        " || The Backlight Master Drive™ is a full-array LED backlight technology that combines an ultra-dense LED structure, a spectacular algorithm and a completely new optical design. Powered by the 4K HDR Processor™ X1 Extreme, this technology delivers incredibly deep black, dazzling lights and more vibrant colour. ",
        " || ",
        " || //sonyglobal.scene7.com/is/image/gwtprod/93abebedf98605e91d91881c4e04ed8f?fmt=jpeg",
        "4K HDR Processor X1™ Extreme: So real you can feel it",
        " || Made to enhance the latest generation of 4K HDR pictures, the 4K HDR Processor X1™ Extreme brings reality to every scene. With 40% more real-time image processing than our renowned 4K Processor X1™, it delivers unprecedented picture quality for everything you watch, upscaling content from any source nearer to 4K HDR quality.",
        " || ",
        " || //sonyglobal.scene7.com/is/image/gwtprod/a68eed5e04bbdbea2da587cc974cc161?fmt=jpeg",
        "Uncover the detail with 4K HDR",
        " || A High Dynamic Range (HDR) compatible TV will change the way you look at TV. Combined with 4K Ultra HD resolution, HDR video content delivers exceptional detail, colour and contrast, with a far wider range of brightness than other video formats. The result is the most lifelike picture that TV has ever been able to create, with brilliant highlights and fine detail.",
        " || ",
        " || //sonyglobal.scene7.com/is/image/gwtprod/4fd45e3ec09cede1cf537c428165c504?fmt=jpeg",
        "Backlight Master Drive™",
        " || The Backlight Master Drive™ is a backlight technology that combines an ultra-dense LED structure, a spectacular algorithm and a completely new optical design. Powered by the 4K HDR Processor™ X1 Extreme, this technology delivers incredibly deep black, dazzling lights and more vibrant colour than you've ever seen on the big screen.",
        " || ",
        " || //sonyglobal.scene7.com/is/image/gwtprod/f6cf5e03ee280b7450a5530f9c24fed2?fmt=jpeg",
        "TRILUMINOS™ Display: Extra colours, extra brilliance",
        " || More colours means more realism. A TRILUMINOS™ Display with its specially-developed backlight selectively maps colours across a wider gamut, ensuring subtle colours do not become oversaturated and unnatural. You'll enjoy vivid, authentic images that evoke the emotion in every scene. ",
        " || ",
        " || //sonyglobal.scene7.com/is/image/gwtprod/79c6cebfffa2ff6ab89719259763642e?fmt=jpeg",
        "Dual database processing",
        " || The 4K HDR Processor X1™ Extreme has two imaging databases that work together in real time to improve your picture. By searching through thousands of picture patterns in Sony-exclusive databases for noise reduction and super-resolution, they remove unwanted noise and upscale every image to the clarity of 4K, so you can enjoy incredible picture quality no matter the source.",
        " || ",
        " || //sonyglobal.scene7.com/is/image/gwtprod/d6fec408511bde3ef920d985a9acf032?fmt=jpeg",
        "Explore new worlds with Android TV™",
        " || Your smart TV just got smarter. Enjoy many of your favourite smartphone and tablet experiences on a big, beautiful BRAVIA™ screen. Android TV™ with advanced voice control lets you connect and access content, from movies and TV shows to thousands of apps, simply by talking.",
        " || ",
        " || //sonyglobal.scene7.com/is/image/gwtprod/d1f784becc5611ca2f7913bcbe73ea3e?fmt=jpeg",
        "This TV is recommended by Netflix",
        " || Get a better streaming experience with a Netflix Recommended TV. A Netflix Recommended TV is chosen for its high performance, cutting-edge smart features and easy app access. You can also watch Marco Polo in 4K HDR today, with a premium Netflix subscription. Members will be able to enjoy more HDR content in the coming months. ",
        " || ",
        " || //sonyglobal.scene7.com/is/image/gwtprod/440700d76da976168b2dd9a6ae52d86b?fmt=jpeg",
        "Premium gold finish",
        " || The sophisticated aluminium bezel is finished with a strip of gold finish for a refined look that gives a premium feel to any space. The pale gold colour sits perfectly alongside your furniture for an elegant viewing experience.",
        " || ",
        " || //sonyglobal.scene7.com/is/image/gwtprod/804fdf8f15f06745b7da5d85f7bf09d5?fmt=jpeg",
        "Clean rear look",
        " || Keep wires out of sight, thanks to a hidden cable panel structure. All of your cables are fully concealed behind the panel, and run down through the centre of the stand, so everything looks tidy.",
        " || ",
        " || //sonyglobal.scene7.com/is/image/gwtprod/2d304a2cb33ade1f7f5171f1e5af0211?fmt=jpeg",
        "Easy to plug and play",
        " || Easily connect a USB or HDMI into the side of your TV to start playing. Just close the side cover to keep things tidy when you're not using it.",
        " || ",
        " || //sonyglobal.scene7.com/is/image/gwtprod/b9f45a0d005206bcf9fd44ca0767faf3?fmt=jpeg",
        "Cable-free front",
        " || All of your cables can be neatly arranged across the back of the TV and channelled into the stand, so there are no wires visible from the front.",
        " || ",
        " || //sonyglobal.scene7.com/is/image/gwtprod/818fc0ef8e063ec5a89ef4d366bf394d?fmt=jpeg",
        "Super slim flush surface display",
        " || The screen on this ultra-thin 4K HDR TV has a full flush surface and super-thin bezel so you stay focused on the picture.",
        " || ",
        " || //sonyglobal.scene7.com/is/image/gwtprod/c52024ebe71c293e6352219289b2036c?fmt=jpeg",
        "Motionflow™ XR keeps the action smooth",
        " || Enjoy smooth and sharp details even in fast-moving sequences with Motionflow™ XR. This innovative technology creates and inserts extra frames between the original ones. It compares key visual factors on successive frames, then calculates the split second of missing action in the sequences. Some models also include black-frame insertion for a blur-free and truly cinematic look.",
        " || ",
        " || //sonyglobal.scene7.com/is/image/gwtprod/69b98bb59b8f696e08e788851ca68c17?fmt=jpeg",
        "Backlight Master Drive™: Calibrated beam LED design",
        " || The Backlight Master Drive™ has a new optical LED design which keeps light only where it's needed in each scene. By gathering light more effectively, the design reduces diffusion and the flare effect that might be seen on other full-array TVs, for greater brightness and more accurate contrast than ever before.",
        " || ",
        " || //sonyglobal.scene7.com/is/image/gwtprod/e3029ebca9d72560281d85575a51d4b5?fmt=jpeg",
        "Object-based HDR remaster",
        " || By analyzing the objects in each scene individually, Object-based HDR remaster optimizes and enhances colour and contrast. It brings everything you watch closer to the quality of HDR. Dark elements get darker, bright elements brighter and everything in between is more accurately lit, for never-before-possible realism in every scene.",
        " || ",
        " || //sonyglobal.scene7.com/is/image/gwtprod/3b73d11ea246bb0c06a84efa1dd7f40d?fmt=jpeg",
        "Super Bit Mapping™ 4K HDR",
        " || Super Bit Mapping™ 4K HDR creates a smoother, more natural picture by minimizing its colour banding. With 14-bit powerful signal processing, it breaks up the solid bands of colour of an 8-bit or 10-bit source, up-converting to 14-bit equivalent gradation, with 64 times more colour levels. It delivers graceful reproduction of faces, sunsets and other areas of subtle colour gradation.",
        " || ",
        " || //sonyglobal.scene7.com/is/image/gwtprod/a3114947986d5bf6d790ccf3886a105d?fmt=jpeg",
        "Dual database processing",
        " || The 4K HDR Processor X1™ Extreme has two imaging databases that work together in real time to improve your picture. By searching through thousands of picture patterns in Sony-exclusive databases for noise reduction and super-resolution, they remove unwanted noise and upscale every image to the clarity of 4K, so you can enjoy incredible picture quality no matter the source.",
        " || ",
        " || //sonyglobal.scene7.com/is/image/gwtprod/dcb41d373835e9a9c7b5b8c42edffa2a?fmt=jpeg",
        "Say what you want to see with voice search",
        " || Spend less time browsing, and more time watching. Voice search on Android TV™ provides you with the power of Google search, allowing you to find content across different services without the hassle of time-consuming text entry. You can also get recommendations; asking for \"romantic comedies\", for example, brings up a list of suitable options.",
        " || ",
        " || //sonyglobal.scene7.com/is/image/gwtprod/ba034edb59b5194afa7385f161208a8f?fmt=jpeg",
        "Content Bar: Find everything fast",
        " || The unobtrusive Content Bar quickly lets you find the movie, TV show or video you’re looking for. Call up the Content Bar and you can keep watching while you scan through live TV, videos on demand, downloaded TV shows and much more. You can even customise the content bar to show you the content you go to most often first. ",
        " || ",
        " || //sonyglobal.scene7.com/is/image/gwtprod/3bd20dd80bd10ef29c60448bc464762a?fmt=png-alpha",
        "Chromecast built-in: Plays nice with your other devices",
        " || BRAVIA™ is Chromecast built-in ready so you can easily cast your favourite entertainment like YouTube™ or Netflix from your personal device on to the stunning BRAVIA™ screen. You can cast from Android™, iOS™ or your laptop.",
        " || ",
        " || //sonyglobal.scene7.com/is/image/gwtprod/e9788aff1f6fdd44b84a87db81b7df9a?fmt=jpeg",
        "Google Play™: A world of content and apps",
        " || Discover movies and TV shows, games and much more from Google Play™. Enjoy a huge and ever-growing choice of apps on your TV in a brand new way.",
        " || ",
        " || //sonyglobal.scene7.com/is/image/gwtprod/f4d3f43a04480099dd9b55b6ce6e299a?fmt=jpeg",
        "Made to listen: ClearAudio+",
        " || Make your listening as lifelike as your viewing. ClearAudio+ fine-tunes TV sound for an immersive experience that seems to surround you. Hear music, dialogue and surround effects with greater clarity and separation, whatever you're watching.",
        " || ",
        " || //sonyglobal.scene7.com/is/image/gwtprod/f7d3418891d4f8f337c992ba27916811?fmt=jpeg",
        "DSEE restores detail to your digital music",
        " || Low-resolution Internet video, catch-up TV and other heavily compressed audio files don't always sound so great. A large amount of information gets thrown away when digital audio is compressed. With Digital Sound Enhancement Engine (DSEE) technology, lost frequency components (especially high frequencies) are restored for natural sound with a more spacious feel.",
        " || ",
        " || //sonyglobal.scene7.com/is/image/gwtprod/640aae2ff025ae44a1aa4f3e839ae312?fmt=jpeg",
        "Clear Phase for smooth, balanced frequencies",
        " || BRAVIA™ uses a powerful computer model to analyse and compensate for inaccuracies in speaker response. It does this by 'sampling' the speaker frequency with higher precision. This information is fed back to cancel out any peaks or dips in the speaker's natural response – resulting in pure, natural audio with smooth, even reproduction of all frequencies.",
        " || ",
        " || //sonyglobal.scene7.com/is/image/gwtprod/d136a6a3644b8bf260ac587e38521d9d?fmt=jpeg",
        "Cinematic S-Force Front Surround",
        " || Enjoy an immersive soundstage that pulls you into the heart of the action. S-Force Front Surround mimics the way the brain correlates sound sources to create proper volume, time lag and sound wave spectrum — using only left and right speaker channels. By naturally emulating three-dimensional sound fields, you'll enjoy rich, high-fidelity audio across a wider listening area.",
        " || ",
        " || //sonyglobal.scene7.com/is/image/gwtprod/9b2924f3fbefbfe19257c6ed16ff1647?fmt=jpeg",
        "Turn your TV into a digital recorder: USB HDD REC",
        " || Store your favourite TV shows on an external USB hard disk drive to enjoy whenever you want. USB HDD REC allows one-touch and timer recording of a digital broadcast onto any USB HDD device up to 2 TB in capacity. While viewing the show, simply press REC to start recording, which will automatically stop at the end of the programme.",
        " || ",
        " || //sonyglobal.scene7.com/is/image/gwtprod/a5aec82b14bd1e35fc3fe3ae458b56d7?fmt=jpeg",
        "IR Blaster: Control everything with one remote",
        " || The Infra-red (IR) Blaster lets you control other devices in your home from your Sony TV remote. You can use it to control your set-top box (cable box) with the TV remote controller.",
        " || ",
        " || //sonyglobal.scene7.com/is/image/gwtprod/e3ec9771c78f941341a4b8520507a19d?fmt=jpeg",
        "YouView: The best of catch-up and on-demand TV",
        " || With YouView built-in, you can scroll back up to seven days to watch shows from catch-up TV services. You can also access an extensive library of on-demand content. Simply connect your BRAVIA™ to an aerial and broadband connection to get started with YouView.",
        " || ",
        " || //sonyglobal.scene7.com/is/image/gwtprod/d2635895135a0b6d60c0d19c91e70112?fmt=jpeg",
        "Enjoy HDR gaming with PlayStation®",
        " || Sony 4K HDR televisions are perfect partners for PlayStation®4 and PlayStation®4 Pro consoles. Immerse yourself in a responsive, fun-filled gaming experience with vivid textures and intensely vibrant colours. See your favourite games come to life with the incredible picture quality.",
        " || ",
        " || //sonyglobal.scene7.com/is/image/gwtprod/a034ae3494e799f96d98c4f450f47808?fmt=jpeg"
      ],
      "factualShortDescription": "4K Ultra HD TV with 4K HDR Processor X1™ Extreme and Backlight Master Drive™",
      "elevatorPitch": "Discover a picture unlike any other in 4K HDR with ultra-contrast.",
      "mainProductType": "television",
      "tvFeatures": [
        "4K HDR Processor X1 Extreme",
        "X-tended dynamic range",
        "TRILUMINOS display",
        "X-Reality PRO"
      ],
      "televisionScreenSize": "154+ cm (61+)",
      "tvType": [
        "LED",
        "4K HDR TVs",
        "4K Ultra HD",
        "Android TV",
        "Smart TV",
        "High Dynamic Range (HDR)",
        "Netflix Recommended TV",
        "stand4k"
      ],
      "inTheBox": [
        "Analogue Extension Cable",
        "Voice Remote Control type (RMFTX201P)",
        "3D Glasses x 2pcs (TDG-BT400A)",
        "Batteries",
        "AC Power Cord",
        "IR Blaster",
        "Operating Instructions",
        "Quick Setup Guide",
        "Table Top Stand (separate assembly required))"
      ],
      "tvScreenSize": "164 cm (65)",
      "productFileName": "kd-65z9d-in5.json",
      "fullProductInfo": "productId= kd-65z9d-in5_en_IN, locale= en_IN, skuName= KD-65Z9D IN5, modelName= KD-65Z9D, superModelName= Z9D Series, tier= 1, marketingProductName= Z9D 4K HDR with Android TV, longMarketingProductName= Z9D | LED | 4K Ultra HD | High Dynamic Range (HDR) | Smart TV (Android TV™), longDescription= Experience the most stunning picture with the ZD9 4K HDR Android TV, featuring the 4K HDR Processor X1 Extreme and the LED Backlight Master Drive. Explore here., mainCategory= [tv-home-cinema, tvs, televisions], featureIcons= [Available in 164 cm (65), 4K High Dynamic Range, 4K HDR Processor X1™ Extreme, Backlight Master Drive™, Android TV], techSpecs= null, keyTechSpecs= null, topFeatures= [4K HDR Processor X1 Extreme for ultimate realism, Unprecedented contrast with Backlight Master Drive, Amazing contrast with X-tended Dynamic Range™ PRO, Wide colour gamut with TRILUMINOS Display], sunriseDateTime= 1.4762556E12, createdAt= 1.476255305205E12, identifiers_bazaarVoiceExternalId= kd-65z9d-in5, identifiers_id= urn:sony:product:sku:[sku]kd_65_z9_d_in5_en_in, ecoFeatures= [Dynamic Backlight Control helps improve energy efficiency by adjusting backlight brightness as picture content changes., Power Saving Mode helps save energy by adjusting backlight brightness., Back Light Off Mode helps save energy by turning picture off which is realized by both display off on LCD panel and back-light off.], imagesPrimaryShot= [//sonyglobal.scene7.com/is/image/gwtprod/a9a1a4facfa90abf80b09ac5d1509de7?fmt=png-alpha], imagesProductShot= [//sonyglobal.scene7.com/is/image/gwtprod/4ccdd026feda542f3ded3cf9f5c3792a?fmt=png-alpha, //sonyglobal.scene7.com/is/image/gwtprod/86f01c97825b2f04ff6051448683fed2?fmt=png-alpha, //sonyglobal.scene7.com/is/image/gwtprod/1c7a3cf51a32acc2fafe029b57d740d9?fmt=png-alpha, //sonyglobal.scene7.com/is/image/gwtprod/918517c03810f35d5c68113738c7cdf1?fmt=png-alpha, //sonyglobal.scene7.com/is/image/gwtprod/c09a7c2fb87e2e64c1a9382ae6797ee0?fmt=png-alpha, //sonyglobal.scene7.com/is/image/gwtprod/c45aa6c1f7ba8c7c9668908bcb244db1?fmt=png-alpha, //sonyglobal.scene7.com/is/image/gwtprod/1503baae2294dc77bb600929d648b80f?fmt=png-alpha, //sonyglobal.scene7.com/is/image/gwtprod/6e780a96f2b75e7b7f9d22c7e1843420?fmt=png-alpha, //sonyglobal.scene7.com/is/image/gwtprod/d0bb516a95a64b59f50060df18de51c9?fmt=png-alpha, //sonyglobal.scene7.com/is/image/gwtprod/96658fb0741c40ad62691693406e5d83?fmt=png-alpha, //sonyglobal.scene7.com/is/image/gwtprod/e2061b68ccec062e5edb459d550140e6?fmt=png-alpha], featureBenefits= [Backlight Master Drive™,  || The Backlight Master Drive™ is a full-array LED backlight technology that combines an ultra-dense LED structure, a spectacular algorithm and a completely new optical design. Powered by the 4K HDR Processor™ X1 Extreme, this technology delivers incredibly deep black, dazzling lights and more vibrant colour. ,  || ,  || //sonyglobal.scene7.com/is/image/gwtprod/93abebedf98605e91d91881c4e04ed8f?fmt=jpeg, 4K HDR Processor X1™ Extreme: So real you can feel it,  || Made to enhance the latest generation of 4K HDR pictures, the 4K HDR Processor X1™ Extreme brings reality to every scene. With 40% more real-time image processing than our renowned 4K Processor X1™, it delivers unprecedented picture quality for everything you watch, upscaling content from any source nearer to 4K HDR quality.,  || ,  || //sonyglobal.scene7.com/is/image/gwtprod/a68eed5e04bbdbea2da587cc974cc161?fmt=jpeg, Uncover the detail with 4K HDR,  || A High Dynamic Range (HDR) compatible TV will change the way you look at TV. Combined with 4K Ultra HD resolution, HDR video content delivers exceptional detail, colour and contrast, with a far wider range of brightness than other video formats. The result is the most lifelike picture that TV has ever been able to create, with brilliant highlights and fine detail.,  || ,  || //sonyglobal.scene7.com/is/image/gwtprod/4fd45e3ec09cede1cf537c428165c504?fmt=jpeg, Backlight Master Drive™,  || The Backlight Master Drive™ is a backlight technology that combines an ultra-dense LED structure, a spectacular algorithm and a completely new optical design. Powered by the 4K HDR Processor™ X1 Extreme, this technology delivers incredibly deep black, dazzling lights and more vibrant colour than you've ever seen on the big screen.,  || ,  || //sonyglobal.scene7.com/is/image/gwtprod/f6cf5e03ee280b7450a5530f9c24fed2?fmt=jpeg, TRILUMINOS™ Display: Extra colours, extra brilliance,  || More colours means more realism. A TRILUMINOS™ Display with its specially-developed backlight selectively maps colours across a wider gamut, ensuring subtle colours do not become oversaturated and unnatural. You'll enjoy vivid, authentic images that evoke the emotion in every scene. ,  || ,  || //sonyglobal.scene7.com/is/image/gwtprod/79c6cebfffa2ff6ab89719259763642e?fmt=jpeg, Dual database processing,  || The 4K HDR Processor X1™ Extreme has two imaging databases that work together in real time to improve your picture. By searching through thousands of picture patterns in Sony-exclusive databases for noise reduction and super-resolution, they remove unwanted noise and upscale every image to the clarity of 4K, so you can enjoy incredible picture quality no matter the source.,  || ,  || //sonyglobal.scene7.com/is/image/gwtprod/d6fec408511bde3ef920d985a9acf032?fmt=jpeg, Explore new worlds with Android TV™,  || Your smart TV just got smarter. Enjoy many of your favourite smartphone and tablet experiences on a big, beautiful BRAVIA™ screen. Android TV™ with advanced voice control lets you connect and access content, from movies and TV shows to thousands of apps, simply by talking.,  || ,  || //sonyglobal.scene7.com/is/image/gwtprod/d1f784becc5611ca2f7913bcbe73ea3e?fmt=jpeg, This TV is recommended by Netflix,  || Get a better streaming experience with a Netflix Recommended TV. A Netflix Recommended TV is chosen for its high performance, cutting-edge smart features and easy app access. You can also watch Marco Polo in 4K HDR today, with a premium Netflix subscription. Members will be able to enjoy more HDR content in the coming months. ,  || ,  || //sonyglobal.scene7.com/is/image/gwtprod/440700d76da976168b2dd9a6ae52d86b?fmt=jpeg, Premium gold finish,  || The sophisticated aluminium bezel is finished with a strip of gold finish for a refined look that gives a premium feel to any space. The pale gold colour sits perfectly alongside your furniture for an elegant viewing experience.,  || ,  || //sonyglobal.scene7.com/is/image/gwtprod/804fdf8f15f06745b7da5d85f7bf09d5?fmt=jpeg, Clean rear look,  || Keep wires out of sight, thanks to a hidden cable panel structure. All of your cables are fully concealed behind the panel, and run down through the centre of the stand, so everything looks tidy.,  || ,  || //sonyglobal.scene7.com/is/image/gwtprod/2d304a2cb33ade1f7f5171f1e5af0211?fmt=jpeg, Easy to plug and play,  || Easily connect a USB or HDMI into the side of your TV to start playing. Just close the side cover to keep things tidy when you're not using it.,  || ,  || //sonyglobal.scene7.com/is/image/gwtprod/b9f45a0d005206bcf9fd44ca0767faf3?fmt=jpeg, Cable-free front,  || All of your cables can be neatly arranged across the back of the TV and channelled into the stand, so there are no wires visible from the front.,  || ,  || //sonyglobal.scene7.com/is/image/gwtprod/818fc0ef8e063ec5a89ef4d366bf394d?fmt=jpeg, Super slim flush surface display,  || The screen on this ultra-thin 4K HDR TV has a full flush surface and super-thin bezel so you stay focused on the picture.,  || ,  || //sonyglobal.scene7.com/is/image/gwtprod/c52024ebe71c293e6352219289b2036c?fmt=jpeg, Motionflow™ XR keeps the action smooth,  || Enjoy smooth and sharp details even in fast-moving sequences with Motionflow™ XR. This innovative technology creates and inserts extra frames between the original ones. It compares key visual factors on successive frames, then calculates the split second of missing action in the sequences. Some models also include black-frame insertion for a blur-free and truly cinematic look.,  || ,  || //sonyglobal.scene7.com/is/image/gwtprod/69b98bb59b8f696e08e788851ca68c17?fmt=jpeg, Backlight Master Drive™: Calibrated beam LED design,  || The Backlight Master Drive™ has a new optical LED design which keeps light only where it's needed in each scene. By gathering light more effectively, the design reduces diffusion and the flare effect that might be seen on other full-array TVs, for greater brightness and more accurate contrast than ever before.,  || ,  || //sonyglobal.scene7.com/is/image/gwtprod/e3029ebca9d72560281d85575a51d4b5?fmt=jpeg, Object-based HDR remaster,  || By analyzing the objects in each scene individually, Object-based HDR remaster optimizes and enhances colour and contrast. It brings everything you watch closer to the quality of HDR. Dark elements get darker, bright elements brighter and everything in between is more accurately lit, for never-before-possible realism in every scene.,  || ,  || //sonyglobal.scene7.com/is/image/gwtprod/3b73d11ea246bb0c06a84efa1dd7f40d?fmt=jpeg, Super Bit Mapping™ 4K HDR,  || Super Bit Mapping™ 4K HDR creates a smoother, more natural picture by minimizing its colour banding. With 14-bit powerful signal processing, it breaks up the solid bands of colour of an 8-bit or 10-bit source, up-converting to 14-bit equivalent gradation, with 64 times more colour levels. It delivers graceful reproduction of faces, sunsets and other areas of subtle colour gradation.,  || ,  || //sonyglobal.scene7.com/is/image/gwtprod/a3114947986d5bf6d790ccf3886a105d?fmt=jpeg, Dual database processing,  || The 4K HDR Processor X1™ Extreme has two imaging databases that work together in real time to improve your picture. By searching through thousands of picture patterns in Sony-exclusive databases for noise reduction and super-resolution, they remove unwanted noise and upscale every image to the clarity of 4K, so you can enjoy incredible picture quality no matter the source.,  || ,  || //sonyglobal.scene7.com/is/image/gwtprod/dcb41d373835e9a9c7b5b8c42edffa2a?fmt=jpeg, Say what you want to see with voice search,  || Spend less time browsing, and more time watching. Voice search on Android TV™ provides you with the power of Google search, allowing you to find content across different services without the hassle of time-consuming text entry. You can also get recommendations; asking for \"romantic comedies\", for example, brings up a list of suitable options.,  || ,  || //sonyglobal.scene7.com/is/image/gwtprod/ba034edb59b5194afa7385f161208a8f?fmt=jpeg, Content Bar: Find everything fast,  || The unobtrusive Content Bar quickly lets you find the movie, TV show or video you’re looking for. Call up the Content Bar and you can keep watching while you scan through live TV, videos on demand, downloaded TV shows and much more. You can even customise the content bar to show you the content you go to most often first. ,  || ,  || //sonyglobal.scene7.com/is/image/gwtprod/3bd20dd80bd10ef29c60448bc464762a?fmt=png-alpha, Chromecast built-in: Plays nice with your other devices,  || BRAVIA™ is Chromecast built-in ready so you can easily cast your favourite entertainment like YouTube™ or Netflix from your personal device on to the stunning BRAVIA™ screen. You can cast from Android™, iOS™ or your laptop.,  || ,  || //sonyglobal.scene7.com/is/image/gwtprod/e9788aff1f6fdd44b84a87db81b7df9a?fmt=jpeg, Google Play™: A world of content and apps,  || Discover movies and TV shows, games and much more from Google Play™. Enjoy a huge and ever-growing choice of apps on your TV in a brand new way.,  || ,  || //sonyglobal.scene7.com/is/image/gwtprod/f4d3f43a04480099dd9b55b6ce6e299a?fmt=jpeg, Made to listen: ClearAudio+,  || Make your listening as lifelike as your viewing. ClearAudio+ fine-tunes TV sound for an immersive experience that seems to surround you. Hear music, dialogue and surround effects with greater clarity and separation, whatever you're watching.,  || ,  || //sonyglobal.scene7.com/is/image/gwtprod/f7d3418891d4f8f337c992ba27916811?fmt=jpeg, DSEE restores detail to your digital music,  || Low-resolution Internet video, catch-up TV and other heavily compressed audio files don't always sound so great. A large amount of information gets thrown away when digital audio is compressed. With Digital Sound Enhancement Engine (DSEE) technology, lost frequency components (especially high frequencies) are restored for natural sound with a more spacious feel.,  || ,  || //sonyglobal.scene7.com/is/image/gwtprod/640aae2ff025ae44a1aa4f3e839ae312?fmt=jpeg, Clear Phase for smooth, balanced frequencies,  || BRAVIA™ uses a powerful computer model to analyse and compensate for inaccuracies in speaker response. It does this by 'sampling' the speaker frequency with higher precision. This information is fed back to cancel out any peaks or dips in the speaker's natural response – resulting in pure, natural audio with smooth, even reproduction of all frequencies.,  || ,  || //sonyglobal.scene7.com/is/image/gwtprod/d136a6a3644b8bf260ac587e38521d9d?fmt=jpeg, Cinematic S-Force Front Surround,  || Enjoy an immersive soundstage that pulls you into the heart of the action. S-Force Front Surround mimics the way the brain correlates sound sources to create proper volume, time lag and sound wave spectrum — using only left and right speaker channels. By naturally emulating three-dimensional sound fields, you'll enjoy rich, high-fidelity audio across a wider listening area.,  || ,  || //sonyglobal.scene7.com/is/image/gwtprod/9b2924f3fbefbfe19257c6ed16ff1647?fmt=jpeg, Turn your TV into a digital recorder: USB HDD REC,  || Store your favourite TV shows on an external USB hard disk drive to enjoy whenever you want. USB HDD REC allows one-touch and timer recording of a digital broadcast onto any USB HDD device up to 2 TB in capacity. While viewing the show, simply press REC to start recording, which will automatically stop at the end of the programme.,  || ,  || //sonyglobal.scene7.com/is/image/gwtprod/a5aec82b14bd1e35fc3fe3ae458b56d7?fmt=jpeg, IR Blaster: Control everything with one remote,  || The Infra-red (IR) Blaster lets you control other devices in your home from your Sony TV remote. You can use it to control your set-top box (cable box) with the TV remote controller.,  || ,  || //sonyglobal.scene7.com/is/image/gwtprod/e3ec9771c78f941341a4b8520507a19d?fmt=jpeg, YouView: The best of catch-up and on-demand TV,  || With YouView built-in, you can scroll back up to seven days to watch shows from catch-up TV services. You can also access an extensive library of on-demand content. Simply connect your BRAVIA™ to an aerial and broadband connection to get started with YouView.,  || ,  || //sonyglobal.scene7.com/is/image/gwtprod/d2635895135a0b6d60c0d19c91e70112?fmt=jpeg, Enjoy HDR gaming with PlayStation®,  || Sony 4K HDR televisions are perfect partners for PlayStation®4 and PlayStation®4 Pro consoles. Immerse yourself in a responsive, fun-filled gaming experience with vivid textures and intensely vibrant colours. See your favourite games come to life with the incredible picture quality.,  || ,  || //sonyglobal.scene7.com/is/image/gwtprod/a034ae3494e799f96d98c4f450f47808?fmt=jpeg], factualShortDescription= 4K Ultra HD TV with 4K HDR Processor X1™ Extreme and Backlight Master Drive™, elevatorPitch= Discover a picture unlike any other in 4K HDR with ultra-contrast., mainProductType= television, tvFeatures= [4K HDR Processor X1 Extreme, X-tended dynamic range, TRILUMINOS display, X-Reality PRO], televisionScreenSize= 154+ cm (61+), tvType= [LED, 4K HDR TVs, 4K Ultra HD, Android TV, Smart TV, High Dynamic Range (HDR), Netflix Recommended TV, stand4k], inTheBox= [Analogue Extension Cable, Voice Remote Control type (RMFTX201P), 3D Glasses x 2pcs (TDG-BT400A), Batteries, AC Power Cord, IR Blaster, Operating Instructions, Quick Setup Guide, Table Top Stand (separate assembly required))], envStatement= null, envLink= null, model= null, superModel= null, tvScreenSize= 164 cm (65), productFileName= kd-65z9d-in5.json",
      "_version_": 1572442397509419008
    },
    {
      "productId": "kd-65z9d-in5_en_IN",
      "locale": "en_IN",
      "skuName": "KD-65Z9D IN5",
      "modelName": "KD-65Z9D",
      "superModelName": "Z9D Series",
      "tier": "1",
      "marketingProductName": "Z9D 4K HDR with Android TV",
      "longMarketingProductName": "Z9D | LED | 4K Ultra HD | High Dynamic Range (HDR) | Smart TV (Android TV™)",
      "longDescription": "Experience the most stunning picture with the ZD9 4K HDR Android TV, featuring the 4K HDR Processor X1 Extreme and the LED Backlight Master Drive. Explore here.",
      "mainCategory": [
        "tv-home-cinema",
        "tvs",
        "televisions"
      ],
      "featureIcons": [
        "Available in 164 cm (65)",
        "4K High Dynamic Range",
        "4K HDR Processor X1™ Extreme",
        "Backlight Master Drive™",
        "Android TV"
      ],
      "topFeatures": [
        "4K HDR Processor X1 Extreme for ultimate realism",
        "Unprecedented contrast with Backlight Master Drive",
        "Amazing contrast with X-tended Dynamic Range™ PRO",
        "Wide colour gamut with TRILUMINOS Display"
      ],
      "sunriseDateTime": 1476255600000,
      "createdAt": 1476255305205,
      "identifiers_bazaarVoiceExternalId": "kd-65z9d-in5",
      "identifiers_id": "urn:sony:product:sku:[sku]kd_65_z9_d_in5_en_in",
      "ecoFeatures": [
        "Dynamic Backlight Control helps improve energy efficiency by adjusting backlight brightness as picture content changes.",
        "Power Saving Mode helps save energy by adjusting backlight brightness.",
        "Back Light Off Mode helps save energy by turning picture off which is realized by both display off on LCD panel and back-light off."
      ],
      "imagesPrimaryShot": [
        "//sonyglobal.scene7.com/is/image/gwtprod/a9a1a4facfa90abf80b09ac5d1509de7?fmt=png-alpha"
      ],
      "imagesProductShot": [
        "//sonyglobal.scene7.com/is/image/gwtprod/4ccdd026feda542f3ded3cf9f5c3792a?fmt=png-alpha",
        "//sonyglobal.scene7.com/is/image/gwtprod/86f01c97825b2f04ff6051448683fed2?fmt=png-alpha",
        "//sonyglobal.scene7.com/is/image/gwtprod/1c7a3cf51a32acc2fafe029b57d740d9?fmt=png-alpha",
        "//sonyglobal.scene7.com/is/image/gwtprod/918517c03810f35d5c68113738c7cdf1?fmt=png-alpha",
        "//sonyglobal.scene7.com/is/image/gwtprod/c09a7c2fb87e2e64c1a9382ae6797ee0?fmt=png-alpha",
        "//sonyglobal.scene7.com/is/image/gwtprod/c45aa6c1f7ba8c7c9668908bcb244db1?fmt=png-alpha",
        "//sonyglobal.scene7.com/is/image/gwtprod/1503baae2294dc77bb600929d648b80f?fmt=png-alpha",
        "//sonyglobal.scene7.com/is/image/gwtprod/6e780a96f2b75e7b7f9d22c7e1843420?fmt=png-alpha",
        "//sonyglobal.scene7.com/is/image/gwtprod/d0bb516a95a64b59f50060df18de51c9?fmt=png-alpha",
        "//sonyglobal.scene7.com/is/image/gwtprod/96658fb0741c40ad62691693406e5d83?fmt=png-alpha",
        "//sonyglobal.scene7.com/is/image/gwtprod/e2061b68ccec062e5edb459d550140e6?fmt=png-alpha"
      ],
      "featureBenefits": [
        "Backlight Master Drive™",
        " || The Backlight Master Drive™ is a full-array LED backlight technology that combines an ultra-dense LED structure, a spectacular algorithm and a completely new optical design. Powered by the 4K HDR Processor™ X1 Extreme, this technology delivers incredibly deep black, dazzling lights and more vibrant colour. ",
        " || ",
        " || //sonyglobal.scene7.com/is/image/gwtprod/93abebedf98605e91d91881c4e04ed8f?fmt=jpeg",
        "4K HDR Processor X1™ Extreme: So real you can feel it",
        " || Made to enhance the latest generation of 4K HDR pictures, the 4K HDR Processor X1™ Extreme brings reality to every scene. With 40% more real-time image processing than our renowned 4K Processor X1™, it delivers unprecedented picture quality for everything you watch, upscaling content from any source nearer to 4K HDR quality.",
        " || ",
        " || //sonyglobal.scene7.com/is/image/gwtprod/a68eed5e04bbdbea2da587cc974cc161?fmt=jpeg",
        "Uncover the detail with 4K HDR",
        " || A High Dynamic Range (HDR) compatible TV will change the way you look at TV. Combined with 4K Ultra HD resolution, HDR video content delivers exceptional detail, colour and contrast, with a far wider range of brightness than other video formats. The result is the most lifelike picture that TV has ever been able to create, with brilliant highlights and fine detail.",
        " || ",
        " || //sonyglobal.scene7.com/is/image/gwtprod/4fd45e3ec09cede1cf537c428165c504?fmt=jpeg",
        "Backlight Master Drive™",
        " || The Backlight Master Drive™ is a backlight technology that combines an ultra-dense LED structure, a spectacular algorithm and a completely new optical design. Powered by the 4K HDR Processor™ X1 Extreme, this technology delivers incredibly deep black, dazzling lights and more vibrant colour than you've ever seen on the big screen.",
        " || ",
        " || //sonyglobal.scene7.com/is/image/gwtprod/f6cf5e03ee280b7450a5530f9c24fed2?fmt=jpeg",
        "TRILUMINOS™ Display: Extra colours, extra brilliance",
        " || More colours means more realism. A TRILUMINOS™ Display with its specially-developed backlight selectively maps colours across a wider gamut, ensuring subtle colours do not become oversaturated and unnatural. You'll enjoy vivid, authentic images that evoke the emotion in every scene. ",
        " || ",
        " || //sonyglobal.scene7.com/is/image/gwtprod/79c6cebfffa2ff6ab89719259763642e?fmt=jpeg",
        "Dual database processing",
        " || The 4K HDR Processor X1™ Extreme has two imaging databases that work together in real time to improve your picture. By searching through thousands of picture patterns in Sony-exclusive databases for noise reduction and super-resolution, they remove unwanted noise and upscale every image to the clarity of 4K, so you can enjoy incredible picture quality no matter the source.",
        " || ",
        " || //sonyglobal.scene7.com/is/image/gwtprod/d6fec408511bde3ef920d985a9acf032?fmt=jpeg",
        "Explore new worlds with Android TV™",
        " || Your smart TV just got smarter. Enjoy many of your favourite smartphone and tablet experiences on a big, beautiful BRAVIA™ screen. Android TV™ with advanced voice control lets you connect and access content, from movies and TV shows to thousands of apps, simply by talking.",
        " || ",
        " || //sonyglobal.scene7.com/is/image/gwtprod/d1f784becc5611ca2f7913bcbe73ea3e?fmt=jpeg",
        "This TV is recommended by Netflix",
        " || Get a better streaming experience with a Netflix Recommended TV. A Netflix Recommended TV is chosen for its high performance, cutting-edge smart features and easy app access. You can also watch Marco Polo in 4K HDR today, with a premium Netflix subscription. Members will be able to enjoy more HDR content in the coming months. ",
        " || ",
        " || //sonyglobal.scene7.com/is/image/gwtprod/440700d76da976168b2dd9a6ae52d86b?fmt=jpeg",
        "Premium gold finish",
        " || The sophisticated aluminium bezel is finished with a strip of gold finish for a refined look that gives a premium feel to any space. The pale gold colour sits perfectly alongside your furniture for an elegant viewing experience.",
        " || ",
        " || //sonyglobal.scene7.com/is/image/gwtprod/804fdf8f15f06745b7da5d85f7bf09d5?fmt=jpeg",
        "Clean rear look",
        " || Keep wires out of sight, thanks to a hidden cable panel structure. All of your cables are fully concealed behind the panel, and run down through the centre of the stand, so everything looks tidy.",
        " || ",
        " || //sonyglobal.scene7.com/is/image/gwtprod/2d304a2cb33ade1f7f5171f1e5af0211?fmt=jpeg",
        "Easy to plug and play",
        " || Easily connect a USB or HDMI into the side of your TV to start playing. Just close the side cover to keep things tidy when you're not using it.",
        " || ",
        " || //sonyglobal.scene7.com/is/image/gwtprod/b9f45a0d005206bcf9fd44ca0767faf3?fmt=jpeg",
        "Cable-free front",
        " || All of your cables can be neatly arranged across the back of the TV and channelled into the stand, so there are no wires visible from the front.",
        " || ",
        " || //sonyglobal.scene7.com/is/image/gwtprod/818fc0ef8e063ec5a89ef4d366bf394d?fmt=jpeg",
        "Super slim flush surface display",
        " || The screen on this ultra-thin 4K HDR TV has a full flush surface and super-thin bezel so you stay focused on the picture.",
        " || ",
        " || //sonyglobal.scene7.com/is/image/gwtprod/c52024ebe71c293e6352219289b2036c?fmt=jpeg",
        "Motionflow™ XR keeps the action smooth",
        " || Enjoy smooth and sharp details even in fast-moving sequences with Motionflow™ XR. This innovative technology creates and inserts extra frames between the original ones. It compares key visual factors on successive frames, then calculates the split second of missing action in the sequences. Some models also include black-frame insertion for a blur-free and truly cinematic look.",
        " || ",
        " || //sonyglobal.scene7.com/is/image/gwtprod/69b98bb59b8f696e08e788851ca68c17?fmt=jpeg",
        "Backlight Master Drive™: Calibrated beam LED design",
        " || The Backlight Master Drive™ has a new optical LED design which keeps light only where it's needed in each scene. By gathering light more effectively, the design reduces diffusion and the flare effect that might be seen on other full-array TVs, for greater brightness and more accurate contrast than ever before.",
        " || ",
        " || //sonyglobal.scene7.com/is/image/gwtprod/e3029ebca9d72560281d85575a51d4b5?fmt=jpeg",
        "Object-based HDR remaster",
        " || By analyzing the objects in each scene individually, Object-based HDR remaster optimizes and enhances colour and contrast. It brings everything you watch closer to the quality of HDR. Dark elements get darker, bright elements brighter and everything in between is more accurately lit, for never-before-possible realism in every scene.",
        " || ",
        " || //sonyglobal.scene7.com/is/image/gwtprod/3b73d11ea246bb0c06a84efa1dd7f40d?fmt=jpeg",
        "Super Bit Mapping™ 4K HDR",
        " || Super Bit Mapping™ 4K HDR creates a smoother, more natural picture by minimizing its colour banding. With 14-bit powerful signal processing, it breaks up the solid bands of colour of an 8-bit or 10-bit source, up-converting to 14-bit equivalent gradation, with 64 times more colour levels. It delivers graceful reproduction of faces, sunsets and other areas of subtle colour gradation.",
        " || ",
        " || //sonyglobal.scene7.com/is/image/gwtprod/a3114947986d5bf6d790ccf3886a105d?fmt=jpeg",
        "Dual database processing",
        " || The 4K HDR Processor X1™ Extreme has two imaging databases that work together in real time to improve your picture. By searching through thousands of picture patterns in Sony-exclusive databases for noise reduction and super-resolution, they remove unwanted noise and upscale every image to the clarity of 4K, so you can enjoy incredible picture quality no matter the source.",
        " || ",
        " || //sonyglobal.scene7.com/is/image/gwtprod/dcb41d373835e9a9c7b5b8c42edffa2a?fmt=jpeg",
        "Say what you want to see with voice search",
        " || Spend less time browsing, and more time watching. Voice search on Android TV™ provides you with the power of Google search, allowing you to find content across different services without the hassle of time-consuming text entry. You can also get recommendations; asking for \"romantic comedies\", for example, brings up a list of suitable options.",
        " || ",
        " || //sonyglobal.scene7.com/is/image/gwtprod/ba034edb59b5194afa7385f161208a8f?fmt=jpeg",
        "Content Bar: Find everything fast",
        " || The unobtrusive Content Bar quickly lets you find the movie, TV show or video you’re looking for. Call up the Content Bar and you can keep watching while you scan through live TV, videos on demand, downloaded TV shows and much more. You can even customise the content bar to show you the content you go to most often first. ",
        " || ",
        " || //sonyglobal.scene7.com/is/image/gwtprod/3bd20dd80bd10ef29c60448bc464762a?fmt=png-alpha",
        "Chromecast built-in: Plays nice with your other devices",
        " || BRAVIA™ is Chromecast built-in ready so you can easily cast your favourite entertainment like YouTube™ or Netflix from your personal device on to the stunning BRAVIA™ screen. You can cast from Android™, iOS™ or your laptop.",
        " || ",
        " || //sonyglobal.scene7.com/is/image/gwtprod/e9788aff1f6fdd44b84a87db81b7df9a?fmt=jpeg",
        "Google Play™: A world of content and apps",
        " || Discover movies and TV shows, games and much more from Google Play™. Enjoy a huge and ever-growing choice of apps on your TV in a brand new way.",
        " || ",
        " || //sonyglobal.scene7.com/is/image/gwtprod/f4d3f43a04480099dd9b55b6ce6e299a?fmt=jpeg",
        "Made to listen: ClearAudio+",
        " || Make your listening as lifelike as your viewing. ClearAudio+ fine-tunes TV sound for an immersive experience that seems to surround you. Hear music, dialogue and surround effects with greater clarity and separation, whatever you're watching.",
        " || ",
        " || //sonyglobal.scene7.com/is/image/gwtprod/f7d3418891d4f8f337c992ba27916811?fmt=jpeg",
        "DSEE restores detail to your digital music",
        " || Low-resolution Internet video, catch-up TV and other heavily compressed audio files don't always sound so great. A large amount of information gets thrown away when digital audio is compressed. With Digital Sound Enhancement Engine (DSEE) technology, lost frequency components (especially high frequencies) are restored for natural sound with a more spacious feel.",
        " || ",
        " || //sonyglobal.scene7.com/is/image/gwtprod/640aae2ff025ae44a1aa4f3e839ae312?fmt=jpeg",
        "Clear Phase for smooth, balanced frequencies",
        " || BRAVIA™ uses a powerful computer model to analyse and compensate for inaccuracies in speaker response. It does this by 'sampling' the speaker frequency with higher precision. This information is fed back to cancel out any peaks or dips in the speaker's natural response – resulting in pure, natural audio with smooth, even reproduction of all frequencies.",
        " || ",
        " || //sonyglobal.scene7.com/is/image/gwtprod/d136a6a3644b8bf260ac587e38521d9d?fmt=jpeg",
        "Cinematic S-Force Front Surround",
        " || Enjoy an immersive soundstage that pulls you into the heart of the action. S-Force Front Surround mimics the way the brain correlates sound sources to create proper volume, time lag and sound wave spectrum — using only left and right speaker channels. By naturally emulating three-dimensional sound fields, you'll enjoy rich, high-fidelity audio across a wider listening area.",
        " || ",
        " || //sonyglobal.scene7.com/is/image/gwtprod/9b2924f3fbefbfe19257c6ed16ff1647?fmt=jpeg",
        "Turn your TV into a digital recorder: USB HDD REC",
        " || Store your favourite TV shows on an external USB hard disk drive to enjoy whenever you want. USB HDD REC allows one-touch and timer recording of a digital broadcast onto any USB HDD device up to 2 TB in capacity. While viewing the show, simply press REC to start recording, which will automatically stop at the end of the programme.",
        " || ",
        " || //sonyglobal.scene7.com/is/image/gwtprod/a5aec82b14bd1e35fc3fe3ae458b56d7?fmt=jpeg",
        "IR Blaster: Control everything with one remote",
        " || The Infra-red (IR) Blaster lets you control other devices in your home from your Sony TV remote. You can use it to control your set-top box (cable box) with the TV remote controller.",
        " || ",
        " || //sonyglobal.scene7.com/is/image/gwtprod/e3ec9771c78f941341a4b8520507a19d?fmt=jpeg",
        "YouView: The best of catch-up and on-demand TV",
        " || With YouView built-in, you can scroll back up to seven days to watch shows from catch-up TV services. You can also access an extensive library of on-demand content. Simply connect your BRAVIA™ to an aerial and broadband connection to get started with YouView.",
        " || ",
        " || //sonyglobal.scene7.com/is/image/gwtprod/d2635895135a0b6d60c0d19c91e70112?fmt=jpeg",
        "Enjoy HDR gaming with PlayStation®",
        " || Sony 4K HDR televisions are perfect partners for PlayStation®4 and PlayStation®4 Pro consoles. Immerse yourself in a responsive, fun-filled gaming experience with vivid textures and intensely vibrant colours. See your favourite games come to life with the incredible picture quality.",
        " || ",
        " || //sonyglobal.scene7.com/is/image/gwtprod/a034ae3494e799f96d98c4f450f47808?fmt=jpeg"
      ],
      "factualShortDescription": "4K Ultra HD TV with 4K HDR Processor X1™ Extreme and Backlight Master Drive™",
      "elevatorPitch": "Discover a picture unlike any other in 4K HDR with ultra-contrast.",
      "mainProductType": "television",
      "tvFeatures": [
        "4K HDR Processor X1 Extreme",
        "X-tended dynamic range",
        "TRILUMINOS display",
        "X-Reality PRO"
      ],
      "televisionScreenSize": "154+ cm (61+)",
      "tvType": [
        "LED",
        "4K HDR TVs",
        "4K Ultra HD",
        "Android TV",
        "Smart TV",
        "High Dynamic Range (HDR)",
        "Netflix Recommended TV",
        "stand4k"
      ],
      "inTheBox": [
        "Analogue Extension Cable",
        "Voice Remote Control type (RMFTX201P)",
        "3D Glasses x 2pcs (TDG-BT400A)",
        "Batteries",
        "AC Power Cord",
        "IR Blaster",
        "Operating Instructions",
        "Quick Setup Guide",
        "Table Top Stand (separate assembly required))"
      ],
      "tvScreenSize": "164 cm (65)",
      "productFileName": "kd-65z9d-in5.json",
      "fullProductInfo": "productId= kd-65z9d-in5_en_IN, locale= en_IN, skuName= KD-65Z9D IN5, modelName= KD-65Z9D, superModelName= Z9D Series, tier= 1, marketingProductName= Z9D 4K HDR with Android TV, longMarketingProductName= Z9D | LED | 4K Ultra HD | High Dynamic Range (HDR) | Smart TV (Android TV™), longDescription= Experience the most stunning picture with the ZD9 4K HDR Android TV, featuring the 4K HDR Processor X1 Extreme and the LED Backlight Master Drive. Explore here., mainCategory= [tv-home-cinema, tvs, televisions], featureIcons= [Available in 164 cm (65), 4K High Dynamic Range, 4K HDR Processor X1™ Extreme, Backlight Master Drive™, Android TV], techSpecs= null, keyTechSpecs= null, topFeatures= [4K HDR Processor X1 Extreme for ultimate realism, Unprecedented contrast with Backlight Master Drive, Amazing contrast with X-tended Dynamic Range™ PRO, Wide colour gamut with TRILUMINOS Display], sunriseDateTime= 1.4762556E12, createdAt= 1.476255305205E12, identifiers_bazaarVoiceExternalId= kd-65z9d-in5, identifiers_id= urn:sony:product:sku:[sku]kd_65_z9_d_in5_en_in, ecoFeatures= [Dynamic Backlight Control helps improve energy efficiency by adjusting backlight brightness as picture content changes., Power Saving Mode helps save energy by adjusting backlight brightness., Back Light Off Mode helps save energy by turning picture off which is realized by both display off on LCD panel and back-light off.], imagesPrimaryShot= [//sonyglobal.scene7.com/is/image/gwtprod/a9a1a4facfa90abf80b09ac5d1509de7?fmt=png-alpha], imagesProductShot= [//sonyglobal.scene7.com/is/image/gwtprod/4ccdd026feda542f3ded3cf9f5c3792a?fmt=png-alpha, //sonyglobal.scene7.com/is/image/gwtprod/86f01c97825b2f04ff6051448683fed2?fmt=png-alpha, //sonyglobal.scene7.com/is/image/gwtprod/1c7a3cf51a32acc2fafe029b57d740d9?fmt=png-alpha, //sonyglobal.scene7.com/is/image/gwtprod/918517c03810f35d5c68113738c7cdf1?fmt=png-alpha, //sonyglobal.scene7.com/is/image/gwtprod/c09a7c2fb87e2e64c1a9382ae6797ee0?fmt=png-alpha, //sonyglobal.scene7.com/is/image/gwtprod/c45aa6c1f7ba8c7c9668908bcb244db1?fmt=png-alpha, //sonyglobal.scene7.com/is/image/gwtprod/1503baae2294dc77bb600929d648b80f?fmt=png-alpha, //sonyglobal.scene7.com/is/image/gwtprod/6e780a96f2b75e7b7f9d22c7e1843420?fmt=png-alpha, //sonyglobal.scene7.com/is/image/gwtprod/d0bb516a95a64b59f50060df18de51c9?fmt=png-alpha, //sonyglobal.scene7.com/is/image/gwtprod/96658fb0741c40ad62691693406e5d83?fmt=png-alpha, //sonyglobal.scene7.com/is/image/gwtprod/e2061b68ccec062e5edb459d550140e6?fmt=png-alpha], featureBenefits= [Backlight Master Drive™,  || The Backlight Master Drive™ is a full-array LED backlight technology that combines an ultra-dense LED structure, a spectacular algorithm and a completely new optical design. Powered by the 4K HDR Processor™ X1 Extreme, this technology delivers incredibly deep black, dazzling lights and more vibrant colour. ,  || ,  || //sonyglobal.scene7.com/is/image/gwtprod/93abebedf98605e91d91881c4e04ed8f?fmt=jpeg, 4K HDR Processor X1™ Extreme: So real you can feel it,  || Made to enhance the latest generation of 4K HDR pictures, the 4K HDR Processor X1™ Extreme brings reality to every scene. With 40% more real-time image processing than our renowned 4K Processor X1™, it delivers unprecedented picture quality for everything you watch, upscaling content from any source nearer to 4K HDR quality.,  || ,  || //sonyglobal.scene7.com/is/image/gwtprod/a68eed5e04bbdbea2da587cc974cc161?fmt=jpeg, Uncover the detail with 4K HDR,  || A High Dynamic Range (HDR) compatible TV will change the way you look at TV. Combined with 4K Ultra HD resolution, HDR video content delivers exceptional detail, colour and contrast, with a far wider range of brightness than other video formats. The result is the most lifelike picture that TV has ever been able to create, with brilliant highlights and fine detail.,  || ,  || //sonyglobal.scene7.com/is/image/gwtprod/4fd45e3ec09cede1cf537c428165c504?fmt=jpeg, Backlight Master Drive™,  || The Backlight Master Drive™ is a backlight technology that combines an ultra-dense LED structure, a spectacular algorithm and a completely new optical design. Powered by the 4K HDR Processor™ X1 Extreme, this technology delivers incredibly deep black, dazzling lights and more vibrant colour than you've ever seen on the big screen.,  || ,  || //sonyglobal.scene7.com/is/image/gwtprod/f6cf5e03ee280b7450a5530f9c24fed2?fmt=jpeg, TRILUMINOS™ Display: Extra colours, extra brilliance,  || More colours means more realism. A TRILUMINOS™ Display with its specially-developed backlight selectively maps colours across a wider gamut, ensuring subtle colours do not become oversaturated and unnatural. You'll enjoy vivid, authentic images that evoke the emotion in every scene. ,  || ,  || //sonyglobal.scene7.com/is/image/gwtprod/79c6cebfffa2ff6ab89719259763642e?fmt=jpeg, Dual database processing,  || The 4K HDR Processor X1™ Extreme has two imaging databases that work together in real time to improve your picture. By searching through thousands of picture patterns in Sony-exclusive databases for noise reduction and super-resolution, they remove unwanted noise and upscale every image to the clarity of 4K, so you can enjoy incredible picture quality no matter the source.,  || ,  || //sonyglobal.scene7.com/is/image/gwtprod/d6fec408511bde3ef920d985a9acf032?fmt=jpeg, Explore new worlds with Android TV™,  || Your smart TV just got smarter. Enjoy many of your favourite smartphone and tablet experiences on a big, beautiful BRAVIA™ screen. Android TV™ with advanced voice control lets you connect and access content, from movies and TV shows to thousands of apps, simply by talking.,  || ,  || //sonyglobal.scene7.com/is/image/gwtprod/d1f784becc5611ca2f7913bcbe73ea3e?fmt=jpeg, This TV is recommended by Netflix,  || Get a better streaming experience with a Netflix Recommended TV. A Netflix Recommended TV is chosen for its high performance, cutting-edge smart features and easy app access. You can also watch Marco Polo in 4K HDR today, with a premium Netflix subscription. Members will be able to enjoy more HDR content in the coming months. ,  || ,  || //sonyglobal.scene7.com/is/image/gwtprod/440700d76da976168b2dd9a6ae52d86b?fmt=jpeg, Premium gold finish,  || The sophisticated aluminium bezel is finished with a strip of gold finish for a refined look that gives a premium feel to any space. The pale gold colour sits perfectly alongside your furniture for an elegant viewing experience.,  || ,  || //sonyglobal.scene7.com/is/image/gwtprod/804fdf8f15f06745b7da5d85f7bf09d5?fmt=jpeg, Clean rear look,  || Keep wires out of sight, thanks to a hidden cable panel structure. All of your cables are fully concealed behind the panel, and run down through the centre of the stand, so everything looks tidy.,  || ,  || //sonyglobal.scene7.com/is/image/gwtprod/2d304a2cb33ade1f7f5171f1e5af0211?fmt=jpeg, Easy to plug and play,  || Easily connect a USB or HDMI into the side of your TV to start playing. Just close the side cover to keep things tidy when you're not using it.,  || ,  || //sonyglobal.scene7.com/is/image/gwtprod/b9f45a0d005206bcf9fd44ca0767faf3?fmt=jpeg, Cable-free front,  || All of your cables can be neatly arranged across the back of the TV and channelled into the stand, so there are no wires visible from the front.,  || ,  || //sonyglobal.scene7.com/is/image/gwtprod/818fc0ef8e063ec5a89ef4d366bf394d?fmt=jpeg, Super slim flush surface display,  || The screen on this ultra-thin 4K HDR TV has a full flush surface and super-thin bezel so you stay focused on the picture.,  || ,  || //sonyglobal.scene7.com/is/image/gwtprod/c52024ebe71c293e6352219289b2036c?fmt=jpeg, Motionflow™ XR keeps the action smooth,  || Enjoy smooth and sharp details even in fast-moving sequences with Motionflow™ XR. This innovative technology creates and inserts extra frames between the original ones. It compares key visual factors on successive frames, then calculates the split second of missing action in the sequences. Some models also include black-frame insertion for a blur-free and truly cinematic look.,  || ,  || //sonyglobal.scene7.com/is/image/gwtprod/69b98bb59b8f696e08e788851ca68c17?fmt=jpeg, Backlight Master Drive™: Calibrated beam LED design,  || The Backlight Master Drive™ has a new optical LED design which keeps light only where it's needed in each scene. By gathering light more effectively, the design reduces diffusion and the flare effect that might be seen on other full-array TVs, for greater brightness and more accurate contrast than ever before.,  || ,  || //sonyglobal.scene7.com/is/image/gwtprod/e3029ebca9d72560281d85575a51d4b5?fmt=jpeg, Object-based HDR remaster,  || By analyzing the objects in each scene individually, Object-based HDR remaster optimizes and enhances colour and contrast. It brings everything you watch closer to the quality of HDR. Dark elements get darker, bright elements brighter and everything in between is more accurately lit, for never-before-possible realism in every scene.,  || ,  || //sonyglobal.scene7.com/is/image/gwtprod/3b73d11ea246bb0c06a84efa1dd7f40d?fmt=jpeg, Super Bit Mapping™ 4K HDR,  || Super Bit Mapping™ 4K HDR creates a smoother, more natural picture by minimizing its colour banding. With 14-bit powerful signal processing, it breaks up the solid bands of colour of an 8-bit or 10-bit source, up-converting to 14-bit equivalent gradation, with 64 times more colour levels. It delivers graceful reproduction of faces, sunsets and other areas of subtle colour gradation.,  || ,  || //sonyglobal.scene7.com/is/image/gwtprod/a3114947986d5bf6d790ccf3886a105d?fmt=jpeg, Dual database processing,  || The 4K HDR Processor X1™ Extreme has two imaging databases that work together in real time to improve your picture. By searching through thousands of picture patterns in Sony-exclusive databases for noise reduction and super-resolution, they remove unwanted noise and upscale every image to the clarity of 4K, so you can enjoy incredible picture quality no matter the source.,  || ,  || //sonyglobal.scene7.com/is/image/gwtprod/dcb41d373835e9a9c7b5b8c42edffa2a?fmt=jpeg, Say what you want to see with voice search,  || Spend less time browsing, and more time watching. Voice search on Android TV™ provides you with the power of Google search, allowing you to find content across different services without the hassle of time-consuming text entry. You can also get recommendations; asking for \"romantic comedies\", for example, brings up a list of suitable options.,  || ,  || //sonyglobal.scene7.com/is/image/gwtprod/ba034edb59b5194afa7385f161208a8f?fmt=jpeg, Content Bar: Find everything fast,  || The unobtrusive Content Bar quickly lets you find the movie, TV show or video you’re looking for. Call up the Content Bar and you can keep watching while you scan through live TV, videos on demand, downloaded TV shows and much more. You can even customise the content bar to show you the content you go to most often first. ,  || ,  || //sonyglobal.scene7.com/is/image/gwtprod/3bd20dd80bd10ef29c60448bc464762a?fmt=png-alpha, Chromecast built-in: Plays nice with your other devices,  || BRAVIA™ is Chromecast built-in ready so you can easily cast your favourite entertainment like YouTube™ or Netflix from your personal device on to the stunning BRAVIA™ screen. You can cast from Android™, iOS™ or your laptop.,  || ,  || //sonyglobal.scene7.com/is/image/gwtprod/e9788aff1f6fdd44b84a87db81b7df9a?fmt=jpeg, Google Play™: A world of content and apps,  || Discover movies and TV shows, games and much more from Google Play™. Enjoy a huge and ever-growing choice of apps on your TV in a brand new way.,  || ,  || //sonyglobal.scene7.com/is/image/gwtprod/f4d3f43a04480099dd9b55b6ce6e299a?fmt=jpeg, Made to listen: ClearAudio+,  || Make your listening as lifelike as your viewing. ClearAudio+ fine-tunes TV sound for an immersive experience that seems to surround you. Hear music, dialogue and surround effects with greater clarity and separation, whatever you're watching.,  || ,  || //sonyglobal.scene7.com/is/image/gwtprod/f7d3418891d4f8f337c992ba27916811?fmt=jpeg, DSEE restores detail to your digital music,  || Low-resolution Internet video, catch-up TV and other heavily compressed audio files don't always sound so great. A large amount of information gets thrown away when digital audio is compressed. With Digital Sound Enhancement Engine (DSEE) technology, lost frequency components (especially high frequencies) are restored for natural sound with a more spacious feel.,  || ,  || //sonyglobal.scene7.com/is/image/gwtprod/640aae2ff025ae44a1aa4f3e839ae312?fmt=jpeg, Clear Phase for smooth, balanced frequencies,  || BRAVIA™ uses a powerful computer model to analyse and compensate for inaccuracies in speaker response. It does this by 'sampling' the speaker frequency with higher precision. This information is fed back to cancel out any peaks or dips in the speaker's natural response – resulting in pure, natural audio with smooth, even reproduction of all frequencies.,  || ,  || //sonyglobal.scene7.com/is/image/gwtprod/d136a6a3644b8bf260ac587e38521d9d?fmt=jpeg, Cinematic S-Force Front Surround,  || Enjoy an immersive soundstage that pulls you into the heart of the action. S-Force Front Surround mimics the way the brain correlates sound sources to create proper volume, time lag and sound wave spectrum — using only left and right speaker channels. By naturally emulating three-dimensional sound fields, you'll enjoy rich, high-fidelity audio across a wider listening area.,  || ,  || //sonyglobal.scene7.com/is/image/gwtprod/9b2924f3fbefbfe19257c6ed16ff1647?fmt=jpeg, Turn your TV into a digital recorder: USB HDD REC,  || Store your favourite TV shows on an external USB hard disk drive to enjoy whenever you want. USB HDD REC allows one-touch and timer recording of a digital broadcast onto any USB HDD device up to 2 TB in capacity. While viewing the show, simply press REC to start recording, which will automatically stop at the end of the programme.,  || ,  || //sonyglobal.scene7.com/is/image/gwtprod/a5aec82b14bd1e35fc3fe3ae458b56d7?fmt=jpeg, IR Blaster: Control everything with one remote,  || The Infra-red (IR) Blaster lets you control other devices in your home from your Sony TV remote. You can use it to control your set-top box (cable box) with the TV remote controller.,  || ,  || //sonyglobal.scene7.com/is/image/gwtprod/e3ec9771c78f941341a4b8520507a19d?fmt=jpeg, YouView: The best of catch-up and on-demand TV,  || With YouView built-in, you can scroll back up to seven days to watch shows from catch-up TV services. You can also access an extensive library of on-demand content. Simply connect your BRAVIA™ to an aerial and broadband connection to get started with YouView.,  || ,  || //sonyglobal.scene7.com/is/image/gwtprod/d2635895135a0b6d60c0d19c91e70112?fmt=jpeg, Enjoy HDR gaming with PlayStation®,  || Sony 4K HDR televisions are perfect partners for PlayStation®4 and PlayStation®4 Pro consoles. Immerse yourself in a responsive, fun-filled gaming experience with vivid textures and intensely vibrant colours. See your favourite games come to life with the incredible picture quality.,  || ,  || //sonyglobal.scene7.com/is/image/gwtprod/a034ae3494e799f96d98c4f450f47808?fmt=jpeg], factualShortDescription= 4K Ultra HD TV with 4K HDR Processor X1™ Extreme and Backlight Master Drive™, elevatorPitch= Discover a picture unlike any other in 4K HDR with ultra-contrast., mainProductType= television, tvFeatures= [4K HDR Processor X1 Extreme, X-tended dynamic range, TRILUMINOS display, X-Reality PRO], televisionScreenSize= 154+ cm (61+), tvType= [LED, 4K HDR TVs, 4K Ultra HD, Android TV, Smart TV, High Dynamic Range (HDR), Netflix Recommended TV, stand4k], inTheBox= [Analogue Extension Cable, Voice Remote Control type (RMFTX201P), 3D Glasses x 2pcs (TDG-BT400A), Batteries, AC Power Cord, IR Blaster, Operating Instructions, Quick Setup Guide, Table Top Stand (separate assembly required))], envStatement= null, envLink= null, model= null, superModel= null, tvScreenSize= 164 cm (65), productFileName= kd-65z9d-in5.json",
      "_version_": 1572442397509419008
    },
    {
      "productId": "kd-65z9d-in5_en_IN",
      "locale": "en_IN",
      "skuName": "KD-65Z9D IN5",
      "modelName": "KD-65Z9D",
      "superModelName": "Z9D Series",
      "tier": "1",
      "marketingProductName": "Z9D 4K HDR with Android TV",
      "longMarketingProductName": "Z9D | LED | 4K Ultra HD | High Dynamic Range (HDR) | Smart TV (Android TV™)",
      "longDescription": "Experience the most stunning picture with the ZD9 4K HDR Android TV, featuring the 4K HDR Processor X1 Extreme and the LED Backlight Master Drive. Explore here.",
      "mainCategory": [
        "tv-home-cinema",
        "tvs",
        "televisions"
      ],
      "featureIcons": [
        "Available in 164 cm (65)",
        "4K High Dynamic Range",
        "4K HDR Processor X1™ Extreme",
        "Backlight Master Drive™",
        "Android TV"
      ],
      "topFeatures": [
        "4K HDR Processor X1 Extreme for ultimate realism",
        "Unprecedented contrast with Backlight Master Drive",
        "Amazing contrast with X-tended Dynamic Range™ PRO",
        "Wide colour gamut with TRILUMINOS Display"
      ],
      "sunriseDateTime": 1476255600000,
      "createdAt": 1476255305205,
      "identifiers_bazaarVoiceExternalId": "kd-65z9d-in5",
      "identifiers_id": "urn:sony:product:sku:[sku]kd_65_z9_d_in5_en_in",
      "ecoFeatures": [
        "Dynamic Backlight Control helps improve energy efficiency by adjusting backlight brightness as picture content changes.",
        "Power Saving Mode helps save energy by adjusting backlight brightness.",
        "Back Light Off Mode helps save energy by turning picture off which is realized by both display off on LCD panel and back-light off."
      ],
      "imagesPrimaryShot": [
        "//sonyglobal.scene7.com/is/image/gwtprod/a9a1a4facfa90abf80b09ac5d1509de7?fmt=png-alpha"
      ],
      "imagesProductShot": [
        "//sonyglobal.scene7.com/is/image/gwtprod/4ccdd026feda542f3ded3cf9f5c3792a?fmt=png-alpha",
        "//sonyglobal.scene7.com/is/image/gwtprod/86f01c97825b2f04ff6051448683fed2?fmt=png-alpha",
        "//sonyglobal.scene7.com/is/image/gwtprod/1c7a3cf51a32acc2fafe029b57d740d9?fmt=png-alpha",
        "//sonyglobal.scene7.com/is/image/gwtprod/918517c03810f35d5c68113738c7cdf1?fmt=png-alpha",
        "//sonyglobal.scene7.com/is/image/gwtprod/c09a7c2fb87e2e64c1a9382ae6797ee0?fmt=png-alpha",
        "//sonyglobal.scene7.com/is/image/gwtprod/c45aa6c1f7ba8c7c9668908bcb244db1?fmt=png-alpha",
        "//sonyglobal.scene7.com/is/image/gwtprod/1503baae2294dc77bb600929d648b80f?fmt=png-alpha",
        "//sonyglobal.scene7.com/is/image/gwtprod/6e780a96f2b75e7b7f9d22c7e1843420?fmt=png-alpha",
        "//sonyglobal.scene7.com/is/image/gwtprod/d0bb516a95a64b59f50060df18de51c9?fmt=png-alpha",
        "//sonyglobal.scene7.com/is/image/gwtprod/96658fb0741c40ad62691693406e5d83?fmt=png-alpha",
        "//sonyglobal.scene7.com/is/image/gwtprod/e2061b68ccec062e5edb459d550140e6?fmt=png-alpha"
      ],
      "featureBenefits": [
        "Backlight Master Drive™",
        " || The Backlight Master Drive™ is a full-array LED backlight technology that combines an ultra-dense LED structure, a spectacular algorithm and a completely new optical design. Powered by the 4K HDR Processor™ X1 Extreme, this technology delivers incredibly deep black, dazzling lights and more vibrant colour. ",
        " || ",
        " || //sonyglobal.scene7.com/is/image/gwtprod/93abebedf98605e91d91881c4e04ed8f?fmt=jpeg",
        "4K HDR Processor X1™ Extreme: So real you can feel it",
        " || Made to enhance the latest generation of 4K HDR pictures, the 4K HDR Processor X1™ Extreme brings reality to every scene. With 40% more real-time image processing than our renowned 4K Processor X1™, it delivers unprecedented picture quality for everything you watch, upscaling content from any source nearer to 4K HDR quality.",
        " || ",
        " || //sonyglobal.scene7.com/is/image/gwtprod/a68eed5e04bbdbea2da587cc974cc161?fmt=jpeg",
        "Uncover the detail with 4K HDR",
        " || A High Dynamic Range (HDR) compatible TV will change the way you look at TV. Combined with 4K Ultra HD resolution, HDR video content delivers exceptional detail, colour and contrast, with a far wider range of brightness than other video formats. The result is the most lifelike picture that TV has ever been able to create, with brilliant highlights and fine detail.",
        " || ",
        " || //sonyglobal.scene7.com/is/image/gwtprod/4fd45e3ec09cede1cf537c428165c504?fmt=jpeg",
        "Backlight Master Drive™",
        " || The Backlight Master Drive™ is a backlight technology that combines an ultra-dense LED structure, a spectacular algorithm and a completely new optical design. Powered by the 4K HDR Processor™ X1 Extreme, this technology delivers incredibly deep black, dazzling lights and more vibrant colour than you've ever seen on the big screen.",
        " || ",
        " || //sonyglobal.scene7.com/is/image/gwtprod/f6cf5e03ee280b7450a5530f9c24fed2?fmt=jpeg",
        "TRILUMINOS™ Display: Extra colours, extra brilliance",
        " || More colours means more realism. A TRILUMINOS™ Display with its specially-developed backlight selectively maps colours across a wider gamut, ensuring subtle colours do not become oversaturated and unnatural. You'll enjoy vivid, authentic images that evoke the emotion in every scene. ",
        " || ",
        " || //sonyglobal.scene7.com/is/image/gwtprod/79c6cebfffa2ff6ab89719259763642e?fmt=jpeg",
        "Dual database processing",
        " || The 4K HDR Processor X1™ Extreme has two imaging databases that work together in real time to improve your picture. By searching through thousands of picture patterns in Sony-exclusive databases for noise reduction and super-resolution, they remove unwanted noise and upscale every image to the clarity of 4K, so you can enjoy incredible picture quality no matter the source.",
        " || ",
        " || //sonyglobal.scene7.com/is/image/gwtprod/d6fec408511bde3ef920d985a9acf032?fmt=jpeg",
        "Explore new worlds with Android TV™",
        " || Your smart TV just got smarter. Enjoy many of your favourite smartphone and tablet experiences on a big, beautiful BRAVIA™ screen. Android TV™ with advanced voice control lets you connect and access content, from movies and TV shows to thousands of apps, simply by talking.",
        " || ",
        " || //sonyglobal.scene7.com/is/image/gwtprod/d1f784becc5611ca2f7913bcbe73ea3e?fmt=jpeg",
        "This TV is recommended by Netflix",
        " || Get a better streaming experience with a Netflix Recommended TV. A Netflix Recommended TV is chosen for its high performance, cutting-edge smart features and easy app access. You can also watch Marco Polo in 4K HDR today, with a premium Netflix subscription. Members will be able to enjoy more HDR content in the coming months. ",
        " || ",
        " || //sonyglobal.scene7.com/is/image/gwtprod/440700d76da976168b2dd9a6ae52d86b?fmt=jpeg",
        "Premium gold finish",
        " || The sophisticated aluminium bezel is finished with a strip of gold finish for a refined look that gives a premium feel to any space. The pale gold colour sits perfectly alongside your furniture for an elegant viewing experience.",
        " || ",
        " || //sonyglobal.scene7.com/is/image/gwtprod/804fdf8f15f06745b7da5d85f7bf09d5?fmt=jpeg",
        "Clean rear look",
        " || Keep wires out of sight, thanks to a hidden cable panel structure. All of your cables are fully concealed behind the panel, and run down through the centre of the stand, so everything looks tidy.",
        " || ",
        " || //sonyglobal.scene7.com/is/image/gwtprod/2d304a2cb33ade1f7f5171f1e5af0211?fmt=jpeg",
        "Easy to plug and play",
        " || Easily connect a USB or HDMI into the side of your TV to start playing. Just close the side cover to keep things tidy when you're not using it.",
        " || ",
        " || //sonyglobal.scene7.com/is/image/gwtprod/b9f45a0d005206bcf9fd44ca0767faf3?fmt=jpeg",
        "Cable-free front",
        " || All of your cables can be neatly arranged across the back of the TV and channelled into the stand, so there are no wires visible from the front.",
        " || ",
        " || //sonyglobal.scene7.com/is/image/gwtprod/818fc0ef8e063ec5a89ef4d366bf394d?fmt=jpeg",
        "Super slim flush surface display",
        " || The screen on this ultra-thin 4K HDR TV has a full flush surface and super-thin bezel so you stay focused on the picture.",
        " || ",
        " || //sonyglobal.scene7.com/is/image/gwtprod/c52024ebe71c293e6352219289b2036c?fmt=jpeg",
        "Motionflow™ XR keeps the action smooth",
        " || Enjoy smooth and sharp details even in fast-moving sequences with Motionflow™ XR. This innovative technology creates and inserts extra frames between the original ones. It compares key visual factors on successive frames, then calculates the split second of missing action in the sequences. Some models also include black-frame insertion for a blur-free and truly cinematic look.",
        " || ",
        " || //sonyglobal.scene7.com/is/image/gwtprod/69b98bb59b8f696e08e788851ca68c17?fmt=jpeg",
        "Backlight Master Drive™: Calibrated beam LED design",
        " || The Backlight Master Drive™ has a new optical LED design which keeps light only where it's needed in each scene. By gathering light more effectively, the design reduces diffusion and the flare effect that might be seen on other full-array TVs, for greater brightness and more accurate contrast than ever before.",
        " || ",
        " || //sonyglobal.scene7.com/is/image/gwtprod/e3029ebca9d72560281d85575a51d4b5?fmt=jpeg",
        "Object-based HDR remaster",
        " || By analyzing the objects in each scene individually, Object-based HDR remaster optimizes and enhances colour and contrast. It brings everything you watch closer to the quality of HDR. Dark elements get darker, bright elements brighter and everything in between is more accurately lit, for never-before-possible realism in every scene.",
        " || ",
        " || //sonyglobal.scene7.com/is/image/gwtprod/3b73d11ea246bb0c06a84efa1dd7f40d?fmt=jpeg",
        "Super Bit Mapping™ 4K HDR",
        " || Super Bit Mapping™ 4K HDR creates a smoother, more natural picture by minimizing its colour banding. With 14-bit powerful signal processing, it breaks up the solid bands of colour of an 8-bit or 10-bit source, up-converting to 14-bit equivalent gradation, with 64 times more colour levels. It delivers graceful reproduction of faces, sunsets and other areas of subtle colour gradation.",
        " || ",
        " || //sonyglobal.scene7.com/is/image/gwtprod/a3114947986d5bf6d790ccf3886a105d?fmt=jpeg",
        "Dual database processing",
        " || The 4K HDR Processor X1™ Extreme has two imaging databases that work together in real time to improve your picture. By searching through thousands of picture patterns in Sony-exclusive databases for noise reduction and super-resolution, they remove unwanted noise and upscale every image to the clarity of 4K, so you can enjoy incredible picture quality no matter the source.",
        " || ",
        " || //sonyglobal.scene7.com/is/image/gwtprod/dcb41d373835e9a9c7b5b8c42edffa2a?fmt=jpeg",
        "Say what you want to see with voice search",
        " || Spend less time browsing, and more time watching. Voice search on Android TV™ provides you with the power of Google search, allowing you to find content across different services without the hassle of time-consuming text entry. You can also get recommendations; asking for \"romantic comedies\", for example, brings up a list of suitable options.",
        " || ",
        " || //sonyglobal.scene7.com/is/image/gwtprod/ba034edb59b5194afa7385f161208a8f?fmt=jpeg",
        "Content Bar: Find everything fast",
        " || The unobtrusive Content Bar quickly lets you find the movie, TV show or video you’re looking for. Call up the Content Bar and you can keep watching while you scan through live TV, videos on demand, downloaded TV shows and much more. You can even customise the content bar to show you the content you go to most often first. ",
        " || ",
        " || //sonyglobal.scene7.com/is/image/gwtprod/3bd20dd80bd10ef29c60448bc464762a?fmt=png-alpha",
        "Chromecast built-in: Plays nice with your other devices",
        " || BRAVIA™ is Chromecast built-in ready so you can easily cast your favourite entertainment like YouTube™ or Netflix from your personal device on to the stunning BRAVIA™ screen. You can cast from Android™, iOS™ or your laptop.",
        " || ",
        " || //sonyglobal.scene7.com/is/image/gwtprod/e9788aff1f6fdd44b84a87db81b7df9a?fmt=jpeg",
        "Google Play™: A world of content and apps",
        " || Discover movies and TV shows, games and much more from Google Play™. Enjoy a huge and ever-growing choice of apps on your TV in a brand new way.",
        " || ",
        " || //sonyglobal.scene7.com/is/image/gwtprod/f4d3f43a04480099dd9b55b6ce6e299a?fmt=jpeg",
        "Made to listen: ClearAudio+",
        " || Make your listening as lifelike as your viewing. ClearAudio+ fine-tunes TV sound for an immersive experience that seems to surround you. Hear music, dialogue and surround effects with greater clarity and separation, whatever you're watching.",
        " || ",
        " || //sonyglobal.scene7.com/is/image/gwtprod/f7d3418891d4f8f337c992ba27916811?fmt=jpeg",
        "DSEE restores detail to your digital music",
        " || Low-resolution Internet video, catch-up TV and other heavily compressed audio files don't always sound so great. A large amount of information gets thrown away when digital audio is compressed. With Digital Sound Enhancement Engine (DSEE) technology, lost frequency components (especially high frequencies) are restored for natural sound with a more spacious feel.",
        " || ",
        " || //sonyglobal.scene7.com/is/image/gwtprod/640aae2ff025ae44a1aa4f3e839ae312?fmt=jpeg",
        "Clear Phase for smooth, balanced frequencies",
        " || BRAVIA™ uses a powerful computer model to analyse and compensate for inaccuracies in speaker response. It does this by 'sampling' the speaker frequency with higher precision. This information is fed back to cancel out any peaks or dips in the speaker's natural response – resulting in pure, natural audio with smooth, even reproduction of all frequencies.",
        " || ",
        " || //sonyglobal.scene7.com/is/image/gwtprod/d136a6a3644b8bf260ac587e38521d9d?fmt=jpeg",
        "Cinematic S-Force Front Surround",
        " || Enjoy an immersive soundstage that pulls you into the heart of the action. S-Force Front Surround mimics the way the brain correlates sound sources to create proper volume, time lag and sound wave spectrum — using only left and right speaker channels. By naturally emulating three-dimensional sound fields, you'll enjoy rich, high-fidelity audio across a wider listening area.",
        " || ",
        " || //sonyglobal.scene7.com/is/image/gwtprod/9b2924f3fbefbfe19257c6ed16ff1647?fmt=jpeg",
        "Turn your TV into a digital recorder: USB HDD REC",
        " || Store your favourite TV shows on an external USB hard disk drive to enjoy whenever you want. USB HDD REC allows one-touch and timer recording of a digital broadcast onto any USB HDD device up to 2 TB in capacity. While viewing the show, simply press REC to start recording, which will automatically stop at the end of the programme.",
        " || ",
        " || //sonyglobal.scene7.com/is/image/gwtprod/a5aec82b14bd1e35fc3fe3ae458b56d7?fmt=jpeg",
        "IR Blaster: Control everything with one remote",
        " || The Infra-red (IR) Blaster lets you control other devices in your home from your Sony TV remote. You can use it to control your set-top box (cable box) with the TV remote controller.",
        " || ",
        " || //sonyglobal.scene7.com/is/image/gwtprod/e3ec9771c78f941341a4b8520507a19d?fmt=jpeg",
        "YouView: The best of catch-up and on-demand TV",
        " || With YouView built-in, you can scroll back up to seven days to watch shows from catch-up TV services. You can also access an extensive library of on-demand content. Simply connect your BRAVIA™ to an aerial and broadband connection to get started with YouView.",
        " || ",
        " || //sonyglobal.scene7.com/is/image/gwtprod/d2635895135a0b6d60c0d19c91e70112?fmt=jpeg",
        "Enjoy HDR gaming with PlayStation®",
        " || Sony 4K HDR televisions are perfect partners for PlayStation®4 and PlayStation®4 Pro consoles. Immerse yourself in a responsive, fun-filled gaming experience with vivid textures and intensely vibrant colours. See your favourite games come to life with the incredible picture quality.",
        " || ",
        " || //sonyglobal.scene7.com/is/image/gwtprod/a034ae3494e799f96d98c4f450f47808?fmt=jpeg"
      ],
      "factualShortDescription": "4K Ultra HD TV with 4K HDR Processor X1™ Extreme and Backlight Master Drive™",
      "elevatorPitch": "Discover a picture unlike any other in 4K HDR with ultra-contrast.",
      "mainProductType": "television",
      "tvFeatures": [
        "4K HDR Processor X1 Extreme",
        "X-tended dynamic range",
        "TRILUMINOS display",
        "X-Reality PRO"
      ],
      "televisionScreenSize": "154+ cm (61+)",
      "tvType": [
        "LED",
        "4K HDR TVs",
        "4K Ultra HD",
        "Android TV",
        "Smart TV",
        "High Dynamic Range (HDR)",
        "Netflix Recommended TV",
        "stand4k"
      ],
      "inTheBox": [
        "Analogue Extension Cable",
        "Voice Remote Control type (RMFTX201P)",
        "3D Glasses x 2pcs (TDG-BT400A)",
        "Batteries",
        "AC Power Cord",
        "IR Blaster",
        "Operating Instructions",
        "Quick Setup Guide",
        "Table Top Stand (separate assembly required))"
      ],
      "tvScreenSize": "164 cm (65)",
      "productFileName": "kd-65z9d-in5.json",
      "fullProductInfo": "productId= kd-65z9d-in5_en_IN, locale= en_IN, skuName= KD-65Z9D IN5, modelName= KD-65Z9D, superModelName= Z9D Series, tier= 1, marketingProductName= Z9D 4K HDR with Android TV, longMarketingProductName= Z9D | LED | 4K Ultra HD | High Dynamic Range (HDR) | Smart TV (Android TV™), longDescription= Experience the most stunning picture with the ZD9 4K HDR Android TV, featuring the 4K HDR Processor X1 Extreme and the LED Backlight Master Drive. Explore here., mainCategory= [tv-home-cinema, tvs, televisions], featureIcons= [Available in 164 cm (65), 4K High Dynamic Range, 4K HDR Processor X1™ Extreme, Backlight Master Drive™, Android TV], techSpecs= null, keyTechSpecs= null, topFeatures= [4K HDR Processor X1 Extreme for ultimate realism, Unprecedented contrast with Backlight Master Drive, Amazing contrast with X-tended Dynamic Range™ PRO, Wide colour gamut with TRILUMINOS Display], sunriseDateTime= 1.4762556E12, createdAt= 1.476255305205E12, identifiers_bazaarVoiceExternalId= kd-65z9d-in5, identifiers_id= urn:sony:product:sku:[sku]kd_65_z9_d_in5_en_in, ecoFeatures= [Dynamic Backlight Control helps improve energy efficiency by adjusting backlight brightness as picture content changes., Power Saving Mode helps save energy by adjusting backlight brightness., Back Light Off Mode helps save energy by turning picture off which is realized by both display off on LCD panel and back-light off.], imagesPrimaryShot= [//sonyglobal.scene7.com/is/image/gwtprod/a9a1a4facfa90abf80b09ac5d1509de7?fmt=png-alpha], imagesProductShot= [//sonyglobal.scene7.com/is/image/gwtprod/4ccdd026feda542f3ded3cf9f5c3792a?fmt=png-alpha, //sonyglobal.scene7.com/is/image/gwtprod/86f01c97825b2f04ff6051448683fed2?fmt=png-alpha, //sonyglobal.scene7.com/is/image/gwtprod/1c7a3cf51a32acc2fafe029b57d740d9?fmt=png-alpha, //sonyglobal.scene7.com/is/image/gwtprod/918517c03810f35d5c68113738c7cdf1?fmt=png-alpha, //sonyglobal.scene7.com/is/image/gwtprod/c09a7c2fb87e2e64c1a9382ae6797ee0?fmt=png-alpha, //sonyglobal.scene7.com/is/image/gwtprod/c45aa6c1f7ba8c7c9668908bcb244db1?fmt=png-alpha, //sonyglobal.scene7.com/is/image/gwtprod/1503baae2294dc77bb600929d648b80f?fmt=png-alpha, //sonyglobal.scene7.com/is/image/gwtprod/6e780a96f2b75e7b7f9d22c7e1843420?fmt=png-alpha, //sonyglobal.scene7.com/is/image/gwtprod/d0bb516a95a64b59f50060df18de51c9?fmt=png-alpha, //sonyglobal.scene7.com/is/image/gwtprod/96658fb0741c40ad62691693406e5d83?fmt=png-alpha, //sonyglobal.scene7.com/is/image/gwtprod/e2061b68ccec062e5edb459d550140e6?fmt=png-alpha], featureBenefits= [Backlight Master Drive™,  || The Backlight Master Drive™ is a full-array LED backlight technology that combines an ultra-dense LED structure, a spectacular algorithm and a completely new optical design. Powered by the 4K HDR Processor™ X1 Extreme, this technology delivers incredibly deep black, dazzling lights and more vibrant colour. ,  || ,  || //sonyglobal.scene7.com/is/image/gwtprod/93abebedf98605e91d91881c4e04ed8f?fmt=jpeg, 4K HDR Processor X1™ Extreme: So real you can feel it,  || Made to enhance the latest generation of 4K HDR pictures, the 4K HDR Processor X1™ Extreme brings reality to every scene. With 40% more real-time image processing than our renowned 4K Processor X1™, it delivers unprecedented picture quality for everything you watch, upscaling content from any source nearer to 4K HDR quality.,  || ,  || //sonyglobal.scene7.com/is/image/gwtprod/a68eed5e04bbdbea2da587cc974cc161?fmt=jpeg, Uncover the detail with 4K HDR,  || A High Dynamic Range (HDR) compatible TV will change the way you look at TV. Combined with 4K Ultra HD resolution, HDR video content delivers exceptional detail, colour and contrast, with a far wider range of brightness than other video formats. The result is the most lifelike picture that TV has ever been able to create, with brilliant highlights and fine detail.,  || ,  || //sonyglobal.scene7.com/is/image/gwtprod/4fd45e3ec09cede1cf537c428165c504?fmt=jpeg, Backlight Master Drive™,  || The Backlight Master Drive™ is a backlight technology that combines an ultra-dense LED structure, a spectacular algorithm and a completely new optical design. Powered by the 4K HDR Processor™ X1 Extreme, this technology delivers incredibly deep black, dazzling lights and more vibrant colour than you've ever seen on the big screen.,  || ,  || //sonyglobal.scene7.com/is/image/gwtprod/f6cf5e03ee280b7450a5530f9c24fed2?fmt=jpeg, TRILUMINOS™ Display: Extra colours, extra brilliance,  || More colours means more realism. A TRILUMINOS™ Display with its specially-developed backlight selectively maps colours across a wider gamut, ensuring subtle colours do not become oversaturated and unnatural. You'll enjoy vivid, authentic images that evoke the emotion in every scene. ,  || ,  || //sonyglobal.scene7.com/is/image/gwtprod/79c6cebfffa2ff6ab89719259763642e?fmt=jpeg, Dual database processing,  || The 4K HDR Processor X1™ Extreme has two imaging databases that work together in real time to improve your picture. By searching through thousands of picture patterns in Sony-exclusive databases for noise reduction and super-resolution, they remove unwanted noise and upscale every image to the clarity of 4K, so you can enjoy incredible picture quality no matter the source.,  || ,  || //sonyglobal.scene7.com/is/image/gwtprod/d6fec408511bde3ef920d985a9acf032?fmt=jpeg, Explore new worlds with Android TV™,  || Your smart TV just got smarter. Enjoy many of your favourite smartphone and tablet experiences on a big, beautiful BRAVIA™ screen. Android TV™ with advanced voice control lets you connect and access content, from movies and TV shows to thousands of apps, simply by talking.,  || ,  || //sonyglobal.scene7.com/is/image/gwtprod/d1f784becc5611ca2f7913bcbe73ea3e?fmt=jpeg, This TV is recommended by Netflix,  || Get a better streaming experience with a Netflix Recommended TV. A Netflix Recommended TV is chosen for its high performance, cutting-edge smart features and easy app access. You can also watch Marco Polo in 4K HDR today, with a premium Netflix subscription. Members will be able to enjoy more HDR content in the coming months. ,  || ,  || //sonyglobal.scene7.com/is/image/gwtprod/440700d76da976168b2dd9a6ae52d86b?fmt=jpeg, Premium gold finish,  || The sophisticated aluminium bezel is finished with a strip of gold finish for a refined look that gives a premium feel to any space. The pale gold colour sits perfectly alongside your furniture for an elegant viewing experience.,  || ,  || //sonyglobal.scene7.com/is/image/gwtprod/804fdf8f15f06745b7da5d85f7bf09d5?fmt=jpeg, Clean rear look,  || Keep wires out of sight, thanks to a hidden cable panel structure. All of your cables are fully concealed behind the panel, and run down through the centre of the stand, so everything looks tidy.,  || ,  || //sonyglobal.scene7.com/is/image/gwtprod/2d304a2cb33ade1f7f5171f1e5af0211?fmt=jpeg, Easy to plug and play,  || Easily connect a USB or HDMI into the side of your TV to start playing. Just close the side cover to keep things tidy when you're not using it.,  || ,  || //sonyglobal.scene7.com/is/image/gwtprod/b9f45a0d005206bcf9fd44ca0767faf3?fmt=jpeg, Cable-free front,  || All of your cables can be neatly arranged across the back of the TV and channelled into the stand, so there are no wires visible from the front.,  || ,  || //sonyglobal.scene7.com/is/image/gwtprod/818fc0ef8e063ec5a89ef4d366bf394d?fmt=jpeg, Super slim flush surface display,  || The screen on this ultra-thin 4K HDR TV has a full flush surface and super-thin bezel so you stay focused on the picture.,  || ,  || //sonyglobal.scene7.com/is/image/gwtprod/c52024ebe71c293e6352219289b2036c?fmt=jpeg, Motionflow™ XR keeps the action smooth,  || Enjoy smooth and sharp details even in fast-moving sequences with Motionflow™ XR. This innovative technology creates and inserts extra frames between the original ones. It compares key visual factors on successive frames, then calculates the split second of missing action in the sequences. Some models also include black-frame insertion for a blur-free and truly cinematic look.,  || ,  || //sonyglobal.scene7.com/is/image/gwtprod/69b98bb59b8f696e08e788851ca68c17?fmt=jpeg, Backlight Master Drive™: Calibrated beam LED design,  || The Backlight Master Drive™ has a new optical LED design which keeps light only where it's needed in each scene. By gathering light more effectively, the design reduces diffusion and the flare effect that might be seen on other full-array TVs, for greater brightness and more accurate contrast than ever before.,  || ,  || //sonyglobal.scene7.com/is/image/gwtprod/e3029ebca9d72560281d85575a51d4b5?fmt=jpeg, Object-based HDR remaster,  || By analyzing the objects in each scene individually, Object-based HDR remaster optimizes and enhances colour and contrast. It brings everything you watch closer to the quality of HDR. Dark elements get darker, bright elements brighter and everything in between is more accurately lit, for never-before-possible realism in every scene.,  || ,  || //sonyglobal.scene7.com/is/image/gwtprod/3b73d11ea246bb0c06a84efa1dd7f40d?fmt=jpeg, Super Bit Mapping™ 4K HDR,  || Super Bit Mapping™ 4K HDR creates a smoother, more natural picture by minimizing its colour banding. With 14-bit powerful signal processing, it breaks up the solid bands of colour of an 8-bit or 10-bit source, up-converting to 14-bit equivalent gradation, with 64 times more colour levels. It delivers graceful reproduction of faces, sunsets and other areas of subtle colour gradation.,  || ,  || //sonyglobal.scene7.com/is/image/gwtprod/a3114947986d5bf6d790ccf3886a105d?fmt=jpeg, Dual database processing,  || The 4K HDR Processor X1™ Extreme has two imaging databases that work together in real time to improve your picture. By searching through thousands of picture patterns in Sony-exclusive databases for noise reduction and super-resolution, they remove unwanted noise and upscale every image to the clarity of 4K, so you can enjoy incredible picture quality no matter the source.,  || ,  || //sonyglobal.scene7.com/is/image/gwtprod/dcb41d373835e9a9c7b5b8c42edffa2a?fmt=jpeg, Say what you want to see with voice search,  || Spend less time browsing, and more time watching. Voice search on Android TV™ provides you with the power of Google search, allowing you to find content across different services without the hassle of time-consuming text entry. You can also get recommendations; asking for \"romantic comedies\", for example, brings up a list of suitable options.,  || ,  || //sonyglobal.scene7.com/is/image/gwtprod/ba034edb59b5194afa7385f161208a8f?fmt=jpeg, Content Bar: Find everything fast,  || The unobtrusive Content Bar quickly lets you find the movie, TV show or video you’re looking for. Call up the Content Bar and you can keep watching while you scan through live TV, videos on demand, downloaded TV shows and much more. You can even customise the content bar to show you the content you go to most often first. ,  || ,  || //sonyglobal.scene7.com/is/image/gwtprod/3bd20dd80bd10ef29c60448bc464762a?fmt=png-alpha, Chromecast built-in: Plays nice with your other devices,  || BRAVIA™ is Chromecast built-in ready so you can easily cast your favourite entertainment like YouTube™ or Netflix from your personal device on to the stunning BRAVIA™ screen. You can cast from Android™, iOS™ or your laptop.,  || ,  || //sonyglobal.scene7.com/is/image/gwtprod/e9788aff1f6fdd44b84a87db81b7df9a?fmt=jpeg, Google Play™: A world of content and apps,  || Discover movies and TV shows, games and much more from Google Play™. Enjoy a huge and ever-growing choice of apps on your TV in a brand new way.,  || ,  || //sonyglobal.scene7.com/is/image/gwtprod/f4d3f43a04480099dd9b55b6ce6e299a?fmt=jpeg, Made to listen: ClearAudio+,  || Make your listening as lifelike as your viewing. ClearAudio+ fine-tunes TV sound for an immersive experience that seems to surround you. Hear music, dialogue and surround effects with greater clarity and separation, whatever you're watching.,  || ,  || //sonyglobal.scene7.com/is/image/gwtprod/f7d3418891d4f8f337c992ba27916811?fmt=jpeg, DSEE restores detail to your digital music,  || Low-resolution Internet video, catch-up TV and other heavily compressed audio files don't always sound so great. A large amount of information gets thrown away when digital audio is compressed. With Digital Sound Enhancement Engine (DSEE) technology, lost frequency components (especially high frequencies) are restored for natural sound with a more spacious feel.,  || ,  || //sonyglobal.scene7.com/is/image/gwtprod/640aae2ff025ae44a1aa4f3e839ae312?fmt=jpeg, Clear Phase for smooth, balanced frequencies,  || BRAVIA™ uses a powerful computer model to analyse and compensate for inaccuracies in speaker response. It does this by 'sampling' the speaker frequency with higher precision. This information is fed back to cancel out any peaks or dips in the speaker's natural response – resulting in pure, natural audio with smooth, even reproduction of all frequencies.,  || ,  || //sonyglobal.scene7.com/is/image/gwtprod/d136a6a3644b8bf260ac587e38521d9d?fmt=jpeg, Cinematic S-Force Front Surround,  || Enjoy an immersive soundstage that pulls you into the heart of the action. S-Force Front Surround mimics the way the brain correlates sound sources to create proper volume, time lag and sound wave spectrum — using only left and right speaker channels. By naturally emulating three-dimensional sound fields, you'll enjoy rich, high-fidelity audio across a wider listening area.,  || ,  || //sonyglobal.scene7.com/is/image/gwtprod/9b2924f3fbefbfe19257c6ed16ff1647?fmt=jpeg, Turn your TV into a digital recorder: USB HDD REC,  || Store your favourite TV shows on an external USB hard disk drive to enjoy whenever you want. USB HDD REC allows one-touch and timer recording of a digital broadcast onto any USB HDD device up to 2 TB in capacity. While viewing the show, simply press REC to start recording, which will automatically stop at the end of the programme.,  || ,  || //sonyglobal.scene7.com/is/image/gwtprod/a5aec82b14bd1e35fc3fe3ae458b56d7?fmt=jpeg, IR Blaster: Control everything with one remote,  || The Infra-red (IR) Blaster lets you control other devices in your home from your Sony TV remote. You can use it to control your set-top box (cable box) with the TV remote controller.,  || ,  || //sonyglobal.scene7.com/is/image/gwtprod/e3ec9771c78f941341a4b8520507a19d?fmt=jpeg, YouView: The best of catch-up and on-demand TV,  || With YouView built-in, you can scroll back up to seven days to watch shows from catch-up TV services. You can also access an extensive library of on-demand content. Simply connect your BRAVIA™ to an aerial and broadband connection to get started with YouView.,  || ,  || //sonyglobal.scene7.com/is/image/gwtprod/d2635895135a0b6d60c0d19c91e70112?fmt=jpeg, Enjoy HDR gaming with PlayStation®,  || Sony 4K HDR televisions are perfect partners for PlayStation®4 and PlayStation®4 Pro consoles. Immerse yourself in a responsive, fun-filled gaming experience with vivid textures and intensely vibrant colours. See your favourite games come to life with the incredible picture quality.,  || ,  || //sonyglobal.scene7.com/is/image/gwtprod/a034ae3494e799f96d98c4f450f47808?fmt=jpeg], factualShortDescription= 4K Ultra HD TV with 4K HDR Processor X1™ Extreme and Backlight Master Drive™, elevatorPitch= Discover a picture unlike any other in 4K HDR with ultra-contrast., mainProductType= television, tvFeatures= [4K HDR Processor X1 Extreme, X-tended dynamic range, TRILUMINOS display, X-Reality PRO], televisionScreenSize= 154+ cm (61+), tvType= [LED, 4K HDR TVs, 4K Ultra HD, Android TV, Smart TV, High Dynamic Range (HDR), Netflix Recommended TV, stand4k], inTheBox= [Analogue Extension Cable, Voice Remote Control type (RMFTX201P), 3D Glasses x 2pcs (TDG-BT400A), Batteries, AC Power Cord, IR Blaster, Operating Instructions, Quick Setup Guide, Table Top Stand (separate assembly required))], envStatement= null, envLink= null, model= null, superModel= null, tvScreenSize= 164 cm (65), productFileName= kd-65z9d-in5.json",
      "_version_": 1572442397509419008
    }
  ],
  "facetResult": {
    "tvType": {
      "4K HDR TVs": 1,
      "4K Ultra HD": 1,
      "Android TV": 1,
      "High Dynamic Range (HDR)": 1,
      "LED": 1,
      "Netflix Recommended TV": 1,
      "Smart TV": 1,
      "stand4k": 1
    },
    "televisionScreenSize": {
      "154+ cm (61+)": 1
    },
    "tvFeatures": {
      "4K HDR Processor X1 Extreme": 1,
      "TRILUMINOS display": 1,
      "X-Reality PRO": 1,
      "X-tended dynamic range": 1
    }
  },
  "inputtagResult": null,
  "totalRows": 1
}